page_url,og:title,og:description,og:site_name,Title,Author,Published Date,Description,Ingredients,Nutrition Facts,Reviews
https://www.simplyrecipes.com/grilled-feta-stuffed-peppers-recipe-11742811,The 4-Ingredient Appetizer I’m Making All Summer Long,You only need four ingredients to make this grilled feta-stuffed peppers recipe. They take under 30 minutes to make and are a fun and festive summertime appetizer or side dish.,Simply Recipes,The 4-Ingredient Appetizer I’m Making All Summer Long,Molly Allen,"May 29, 2025","Grilled Feta-Stuffed Peppers Recipe (4 Ingredients, 25 Minutes)
Prep Time: 20 mins; Cook Time: 5 mins; Total Time: 25 mins; Servings: 8 servings; Yield: 24 half peppers","8 ounces cream cheese, softened, 4 ounces feta cheese, crumbled, 1 pound sweet mini peppers (about 12), 1 tablespoon extra-virgin olive oil, 1/2 teaspoon salt, Vegetable or canola oil, for grill grates, 2 tablespoons chopped fresh chives, optional","Calories: 169, Fat: 15g, Carbs: 6g, Protein: 4g","[{'name': 'Frank T', 'review': 'The filling portion was the perfect amount for 24 pepper halves. The cheese mixture was rich, but I loved the salty notes of the feta mixed with the cream cheese. Even though the chives are listed as optional, I think they add a crucial pop of color and flavor—especially for such a rich filling. The mini sweet peppers added a nice burst of sweetness. My favorite part was the charred edges of the peppers; they gave the dish a smoky flavor that I really enjoyed.'}, {'name': 'Hollis Tischner', 'review': 'Can these be done in the oven? If so, at what temp and how long? Thank you.'}]"
https://www.simplyrecipes.com/franks-redhot-buffalo-chicken-dip-recipe-review-8751086,The Best Dip Recipe on Planet Earth Is on the Back of This Bottle,"Appetizers are the life of the party, and this hot Buffalo chicken dip is a winning recipe. It turns out the best recipe can be found on the back of Frank’s RedHot Original Cayenne Pepper Hot Sauce.",Simply Recipes,The Best Dip Recipe on Planet Earth Is on the Back of This Bottle,"Sara Haas, RDN, LDN","January 31, 2025","The Best Dip Recipe on Planet Earth Is on the Back of This Bottle
",,,
https://www.simplyrecipes.com/millionaire-crackers-recipe-8762206,The 4-Ingredient Appetizer I’m Making for the Holidays This Year,All it takes is four ingredients to make a holiday appetizer no one will forget. Millionaire crackers combine buttery crackers and bacon for the perfect handheld bite.,Simply Recipes,The 4-Ingredient Appetizer I’m Making for the Holidays This Year,Nick Evans,"December 17, 2024","Millionaire Crackers Recipe (4 Ingredients)
","1 sleeve Club (or similar) crackers, about 38 crackers, 2 ounces cream cheese or Boursin cheese, room temperature, 8 strips bacon (not thick-cut), cut into fifths, 1/4 cup packed brown sugar, Crushed red pepper flakes, to taste, optional",,
https://www.simplyrecipes.com/four-ingredient-yogurt-and-fruit-clusters-recipe-8751026,These 4-Ingredient Yogurt Clusters Are the Best Snack I've Made in Years,"Made with yogurt, fruit, and a magic chocolate shell, these yogurt clusters are a perfectly poppable snacky sweet that come together with no effort and minimal time.",Simply Recipes,These 4-Ingredient Yogurt Clusters Are the Best Snack I've Made in Years,Nea Arentzen,"January 16, 2025","4-Ingredient Yogurt Clusters Recipe
","1 cup chopped strawberries (aim for 1/4-inch pieces), 1/4 cup vanilla yogurt, 1/2 cup semi-sweet chocolate chips, 2 tablespoons coconut oil, Flaky sea salt or kosher salt (optional)",,
https://www.simplyrecipes.com/grandma-jeans-snack-mix-recipe-8756379,My Grandma’s Snack Mix Is a Retro Classic You Need To Make,"Loaded with Chex cereal, pretzels, nuts, Cheerios, and tons of flavor, this homemade snack mix recipe is always a big hit. I make my grandmother’s recipe for the holidays every year.",Simply Recipes,My Grandma’s Snack Mix Is a Retro Classic You Need To Make,Molly Adams,"December 18, 2024","Grandma Jean’s Snack Mix Recipe
","8 cups (12 to 13 ounces) Rice Chex Cereal, 4 cups (8 ounces) Wheat Chex Cereal, 3 cups (3 ounces) Cheerios, 2 cups (4 ounces) thin pretzel sticks, broken in half if needed, 2 (10.3-ounce) cans lightly salted mixed nuts (about 4 cups), 2 sticks (8 ounces) unsalted butter, 2 tablespoons, Worcestershire sauce, 2 teaspoons Lawry’s Seasoning Salt, 1/2 teaspoon garlic powder, 1/2 teaspoon onion powder, 3 to 4 dashes hot sauce (I use Frank’s Red Hot)",,
https://www.simplyrecipes.com/queso-fundido-recipe-8781302,"The Hot, Cheesy Dip I Make for Every Gathering","This hearty, flavorful queso fundido dip does double duty! The recipe makes a crowd-pleasing appetizer served with a side of tortilla chips, or you can use it to stuff your favorite tacos.",Simply Recipes,"The Hot, Cheesy Dip I Make for Every Gathering",Samantha Saunion,"January 28, 2025","Queso Fundido Recipe (25 Minutes, 4 Steps, One Pan)
Prep Time: 10 mins; Cook Time: 15 mins; Total Time: 25 mins; Servings: 4
to 6 servings","1 pound ground fresh Mexican-style chorizo (without casing), 1 medium white onion, diced, 1 (4-ounce) can diced green chiles, 1 cup (4 ounces) shredded pepper jack cheese, 1 cup (4 ounces) shredded cheddar cheese, 1 cup (4 ounces) shredded Oaxaca cheese, 1/2 cup diced grape tomatoes, optional, 1/4 cup chopped cilantro, optional, 1 tablespoon crumbled queso fresco, optional, Tortilla chips, for serving","Calories: 509, Fat: 42g, Carbs: 5g, Protein: 28g",
https://www.simplyrecipes.com/french-bread-pizza-recipe-8778483,The Secret to the Best French Bread Pizza,"You can’t beat the convenience of French bread pizza. Follow this recipe for the best-tasting French bread pizza possible, a fun option for lunch, dinner, or a snack.",Simply Recipes,The Secret to the Best French Bread Pizza,Devan Grimsrud,"January 23, 2025","French Bread Pizza Recipe
Prep Time: 5 mins; Cook Time: 15 mins; Total Time: 20 mins; Servings: 4 servings","1 loaf French bread (about 14 ounces), 4 tablespoons butter, room temperature, 3 tablespoons olive oil, plus more for drizzling, 1 cup canned crushed tomatoes (about half a 14-ounce can), 2 cloves garlic, 1 finely grated and 1 whole, 1 teaspoon dried oregano, 1/2 teaspoon chili flakes, Kosher salt, to taste, 4 1/2 ounces fresh mozzarella cheese, 1 sprig fresh Italian basil","Calories: 580, Fat: 31g, Carbs: 57g, Protein: 19g",
https://www.simplyrecipes.com/millionaires-bacon-recipe-8763572,Bacon Is Great But Millionaire’s Bacon Is Better,"Millionaire’s Bacon, a prized brunch or breakfast side dish, features thick-cut bacon glazed with syrup and coated in a flavorful brown sugar-spice rub. Best of all, this recipe can be made days in advance of your breakfast gathering!",Simply Recipes,Bacon Is Great But Millionaire’s Bacon Is Better,Irvin Lin,"December 23, 2024","Millionaire’s Bacon Recipe
Prep Time: 10 mins; Cook Time: 25 mins; Total Time: 35 mins; Servings: 4
to 6 servings","1/2 cup packed dark brown sugar, 1 1/2 teaspoons freshly ground black pepper, 1 teaspoon smoked paprika, 3/4 teaspoon red pepper flakes, 1/2 teaspoon cayenne pepper, 1/2 teaspoon ground ginger, 1 pound thick-cut bacon, center cut preferred, 3 tablespoons maple syrup","Calories: 353, Fat: 20g, Carbs: 23g, Protein: 19g","[{'name': 'Frank T', 'review': 'As the recipe name suggests, the Millionaire&#x27;s Bacon is rich, sweet, and decadent in all the best possible ways. It has a lot of flavor (smokey, sweet, barbecue-like notes), which is reminiscent of candied bacon and I love the spicy kick and twist to it.'}, {'name': 'Caryn Falcone', 'review': 'This was really delicious !Served it at a brunch and though I made 1 and a half pounds for four people I noticed people checking out the plate several times! I was lucky I got one piece! Will make again,not for me alone,because I would eat it all myself!!. Thanks for posting! Best wishes for a Happy Healthy New Year!!'}]"
https://www.simplyrecipes.com/easy-spinach-dip-recipe-6748600,"This Creamy, Easy Spinach Dip Takes Minutes to Whip Up","Classic spinach dip takes a detour to the Mediterranean in this lighter version made with creamy feta, yogurt, sour cream, and thawed frozen spinach. It’s a quick and easy dip to make for an impromptu appetizer.",Simply Recipes,Easy Spinach Dip ,Sally Vargas,"November 05, 2024","Easy Spinach Dip Recipe
Prep Time: 15 mins; Total Time: 15 mins; Servings: 8
to 10 servings; Yield: 4 cups","1 (10 to 12-ounce) package chopped frozen spinach, thawed , 8 ounces creamy feta (such as Bulgarian or French feta), 1 cup plain whole milk Greek yogurt, 3/4 cup sour cream, 2 tablespoons chopped fresh parsley, 1 tablespoon grated yellow onion, 2 teaspoons finely grated lemon zest (from 1/2 large lemon), 1 tablespoon freshly squeezed lemon juice, 1/2 teaspoon coriander seed, ground in a mortar and pestle, or 1/4 teaspoon ground coriander, 1/8 teaspoon cayenne pepper, or to taste, 1 tablespoon olive oil, Salt, to taste, Aleppo pepper flakes, for garnish (optional), Crudites, pita triangles, crackers, chips, or vegetable strips, for serving","Calories: 133, Fat: 10g, Carbs: 5g, Protein: 7g","[{'name': 'Mary', 'review': 'This has a lot of ingredients. Doesn&#x27;t sound that easy.'}]"
https://www.simplyrecipes.com/pickled-garlic-quick-pickle-recipe-6748896,Love Garlic and Pickles? Make Pickled Garlic!,Pickled garlic has all of the delicious garlic flavor you’re looking for without the sharpness of raw garlic. This quick pickle recipe will keep for months in the fridge and is easy to adapt to suit your tastes.,Simply Recipes,Pickled Garlic,Laurel Randolph,"April 21, 2024","Pickled Garlic (Quick Pickle Recipe)
Prep Time: 25 mins; Cook Time: 5 mins; Total Time: 30 mins; Servings: 16 servings; Yield: 1 pint","6 medium heads garlic (or 2 cups peeled cloves), 1 cup white or apple cider vinegar (5% acidity), 1 cup filtered water, 1 1/2 teaspoons sugar, 1 teaspoon pickling, sea, or kosher salt, or to taste (not iodized), 1 teaspoon black peppercorns, 1 teaspoon coriander seeds, optional, 1/2 teaspoon mustard seeds, optional, 1/2 teaspoon cumin seeds, optional","Calories: 40, Fat: 2g, Carbs: 9g, Protein: 1g",
https://www.simplyrecipes.com/how-to-make-quick-pickles-any-vegetable-6749617,Preserve Your Bounty With This All-Purpose Quick Pickling Recipe,"Quick pickles, also known as refrigerator pickles, don’t require canning and will keep in your fridge for months.",Simply Recipes,How To Make Quick Pickles,Laurel Randolph,"July 08, 2024","How to Make Quick Pickles (Any Vegetable!)
Prep Time: 20 mins; Cook Time: 5 mins; Total Time: 25 mins; Servings: 12 servings; Yield: 2 pints","1 pound fresh vegetables like cucumbers, carrots, peppers, zucchini, or onions, 1 cup water, 1/2 cup white vinegar, 1/2 cup apple cider vinegar, 1 to 3 tablespoons sugar, 2 to 3 teaspoons pickling, sea, or kosher salt, 2 teaspoons dried whole spices, like black pepper, red pepper flakes, coriander, mustard seeds, and/or celery seed, 4 sprigs fresh dill, optional","Calories: 20, Fat: 0g, Carbs: 4g, Protein: 0g",
https://www.simplyrecipes.com/sweet-potato-latkes-recipe-6822176,Sweet Potato Latkes are a Fun Twist on Everyone’s Favorite Potato Pancake,"For a twist on the classic potato latke, swap russets for colorful sweet potatoes. These slightly sweet but mostly savory latkes are crispy and delicious, especially with sour cream.",Simply Recipes,Sweet Potato Latkes ,"Micah Siva, RD","January 23, 2024","Sweet Potato Latkes Recipe
Prep Time: 15 mins; Cook Time: 25 mins; Total Time: 40 mins; Servings: 4
to 5 servings; Yield: 12
to 14 latkes","1 1/2 pounds sweet potatoes (3 large or 4 to 5 medium sweet potatoes), 1/2 medium yellow onion, 1/4 cup all-purpose flour, 2 large eggs, 1 teaspoon garlic powder, 1 teaspoon salt, 1/4 teaspoon black pepper, 1 quart vegetable oil, for frying, 1/2 cup sour cream, for serving, optional","Calories: 373, Fat: 24g, Carbs: 35g, Protein: 6g","[{'name': 'Stuart Harris', 'review': 'Can you air fry the latkes?\nI oil fry as little as possible.'}]"
https://www.simplyrecipes.com/loaded-sheet-pan-quesadillas-recipe-6751293,A Giant Sheet Pan Quesadilla Makes Any Night a Party,"Make a giant quesadilla for a crowd on a sheet pan and let the oven do the work. It’s a 10-tortilla wonder, filled with beans and spicy ground beef and oozing with melted cheese.",Simply Recipes,Loaded Sheet Pan Quesadillas,Nick Evans,"January 23, 2024","Loaded Sheet Pan Quesadillas Recipe
Prep Time: 20 mins; Cook Time: 40 mins; Total Time: 60 mins; Servings: 8 servings; Yield: 15 quesadilla pieces","2 tablespoons olive oil, 1 pound lean ground beef, 1 yellow onion, cored and chopped, 1 red pepper, cored and chopped, 1 (15-ounce) can black beans, drained and rinsed, 1 (5-ounce) can mild green chiles, 3 tablespoons taco seasoning, plus more to taste, 1/2 teaspoon kosher salt, plus more to taste, 1/2 teaspoon black pepper, 1/4 cup water, Cooking spray, 10 medium (10-inch) flour tortillas, 16 ounces grated cheddar or Mexican blend cheese, Salsa, Sour cream, Guacamole","Calories: 577, Fat: 33g, Carbs: 34g, Protein: 35g",
https://www.simplyrecipes.com/cheese-straws-recipe-6824797,Serve Easy Homemade Cheese Straws at Your Next Party,"Cheese straws are a classic Southern snack. A cross between a cheese cracker and a savory cookie, they only take a few ingredients to make and are delicious served with wine.",Simply Recipes,Cheese Straws,Laurel Randolph,"November 09, 2022","Cheese Straws Recipe
Prep Time: 20 mins; Cook Time: 15 mins; Total Time: 35 mins; Servings: 12 servings; Yield: 50
to 70 cheese straws","1 3/4 cups (228g) self-rising flour, 1/2 teaspoon smoked or sweet paprika, 1/4 teaspoon cayenne pepper, or to taste, 1/4 teaspoon kosher salt, 1/2 pound sharp or extra-sharp cheddar cheese, freshly grated, 1 stick (1/2 cup) unsalted butter, room temperature, 1 to 4 tablespoons water, or as needed","Calories: 213, Fat: 14g, Carbs: 15g, Protein: 7g","[{'name': 'AP', 'review': 'Tried these and they are super yummy. Thank you'}, {'name': 'cielynne', 'review': ""You are my hero. I came on here looking for a side dish for chili and now have a whole list of recipes I HAVE to try. But I've been looking for a cheese twist recipe for years. Thank you so much. I'm over the moon happy.""}]"
https://www.simplyrecipes.com/shrimp-butter-recipe-6888965,Shrimp Butter Will Be Your New Favorite Party Snack,"Shrimp butter is a retro party snack recipe that’s part spread, part compound butter, and 100 percent delightful. An easy make-ahead appetizer, it’s heavenly smeared on saltines.",Simply Recipes,Shrimp Butter ,Laura Manzano,"November 19, 2024","Shrimp Butter Recipe
Prep Time: 35 mins; Cook Time: 10 mins; Total Time: 45 mins; Servings: 20 servings; Yield: 4 cups","1 small white onion, finely minced (about 1/2 cup), 1 1/2 pounds large shrimp, shell on (see recipe note), 2 teaspoons kosher salt, plus more for salting the water, 1 pound unsalted butter, at room temperature , 2 teaspoons lemon zest, 2 tablespoons lemon juice, 1 tablespoon Worcestershire sauce, 1/4 cup finely chopped fresh parsley, 1/4 cup finely chopped fresh dill, 1/2 teaspoon freshly ground black pepper, 1/2 teaspoon celery seed","Calories: 191, Fat: 19g, Carbs: 1g, Protein: 5g","[{'name': 'Adam ', 'review': ""Why can't you use peeled and deveined shrimp? There are no use for the shell???""}, {'name': 'cta', 'review': 'I have a can of lump crabmeat cn I sub that instead.'}]"
https://www.simplyrecipes.com/fried-pickles-recipe-6826552,You Won't Be Able to Eat Just One of These Crispy Homemade Fried Pickles,"The ultimate snack or easy appetizer. Salty, tangy, and crunchy, they’re especially good dipped in ranch dressing.",Simply Recipes,Fried Pickles,Nick Evans,"April 21, 2025","Fried Pickles Recipe
Prep Time: 15 mins; Cook Time: 15 mins; Total Time: 30 mins; Servings: 4
to 6 servings","1 (16-ounce) jar sliced pickles, 1 cup all-purpose flour, 1 teaspoon Italian seasoning, 3/4 teaspoon kosher salt, divided, 1/2 teaspoon black pepper, 1/2 teaspoon garlic powder, 1/2 cup buttermilk, 2 large eggs, 2 cups Italian seasoned breadcrumbs, 4 cups canola oil, for frying, Ranch dressing or blue cheese dressing, for dipping","Calories: 397, Fat: 31g, Carbs: 24g, Protein: 6g",
https://www.simplyrecipes.com/potato-croquettes-recipe-6889868,Turn Mashed Potatoes Into Something Even Better: Potato Croquettes,"Crispy outside and tender and rich inside, croquettes are to fry at home with our step-by-step recipe.",Simply Recipes,Potato Croquettes,Devan Grimsrud,"February 09, 2025","Potato Croquettes Recipe
Prep Time: 30 mins; Cook Time: 40 mins; Cooling Time: 60 mins; Total Time: 2 hrs 10 mins; Servings: 6
to 8 servings; Yield: 18
to 20 croquettes","1 pound (3 to 4) medium Yukon Gold potatoes, peeled and quartered, 2 tablespoons kosher salt, 3 tablespoons unsalted butter, room temperature, 1/2 teaspoon freshly ground black pepper, or to taste, 1/2 cup finely grated Parmesan cheese, 2 large egg yolks, 2 tablespoons finely chopped chives, 1 cup fine breadcrumbs, 2 large egg whites, Vegetable or canola oil, for frying, Salt, to taste","Calories: 320, Fat: 22g, Carbs: 23g, Protein: 8g",
https://www.simplyrecipes.com/plantain-chips-recipe-7496217,These Easy Baked Plantain Chips Beat Anything from a Store,"Slicing into thin rounds on a mandoline and baking directly on a baking sheet is the key to making these golden, delicately crisp, baked plantain chips.",Simply Recipes,Plantain Chips,Kayla Hoang,"January 23, 2024","Plantain Chips Recipe
Prep Time: 15 mins; Cook Time: 16 mins; Total Time: 31 mins; Servings: 6
to 8 servings; Yield: 3 cups plantain chips","2 medium (about 9 inches) green plantains (about 9 1/2 ounces each), 2 tablespoons olive oil, 1 teaspoon kosher salt","Calories: 93, Fat: 2g, Carbs: 21g, Protein: 1g","[{'name': 'Stephanie L', 'review': 'Super easy recipe. Using a mandoline ensured that all the slices were the same thickness. They baked up crispy, and the amount of salt was just right for me.'}]"
https://www.simplyrecipes.com/easy-whipped-ricotta-toast-recipe-5498683,Easy Whipped Ricotta Toast Is Creamy and Dreamy,"When you whip ricotta, it magically becomes airier, creamier, and perfect for smearing on a sturdy slice of bread. A drizzle of lemony, thyme-y honey on top, and you’ll be spellbound!",Simply Recipes,Easy Whipped Ricotta Toast,Emily Weinberger,"November 04, 2024","Easy Whipped Ricotta Toast Recipe
Prep Time: 15 mins; Cook Time: 10 mins; Total Time: 25 mins; Servings: 5 servings; Yield: 10 ricotta-topped toasts","10 (1/2-inch) slices crusty sourdough bread , 2 tablespoons extra virgin olive oil, plus more for bread, 1 1/2 teaspoons kosher salt, Freshly ground black pepper, 15 ounces whole milk ricotta, Finely grated zest of 1 lemon, 1 tablespoon fresh lemon juice, 1/3 cup honey, 1 teaspoon fresh thyme leaves, Flaky sea salt, for serving (optional)","Calories: 615, Fat: 20g, Carbs: 88g, Protein: 23g",
https://www.simplyrecipes.com/strawberry-salsa-recipe-11732338,I Wait All Year To Make This 4-Ingredient Strawberry Salsa,"This sweet and juicy strawberry salsa recipe is a great way to use peak-season strawberries. It only needs four ingredients and ten minutes to make, and is delicious served with cinnamon-sugar tortilla or pita chips.",Simply Recipes,I Wait All Year To Make This 4-Ingredient Strawberry Salsa,"Micah Siva, RD","May 12, 2025","Strawberry Salsa Recipe (4 Ingredients, 10 Minutes)
","1 pound strawberries, hulled and diced, 2 tablespoons chopped fresh mint, 1 medium lime, 2 teaspoons honey, 1/4 teaspoon kosher salt",,
https://www.simplyrecipes.com/trader-joes-homemade-cowboy-caviar-recipe-6361458,I Can't Get Enough of This Homemade Trader Joe’s Cowboy Caviar,"Make just one trip to our favorite grocery store, Trader Joe’s, for this big and bold homemade cowboy caviar. Don’t forget the chips!",Simply Recipes,Trader Joe’s Homemade Cowboy Caviar,Sara Tane,"November 20, 2024","Trader Joe’s Homemade Cowboy Caviar Recipe
Prep Time: 20 mins; Total Time: 20 mins; Servings: 8
to 10 servings; Yield: 8 cups","2 tablespoons fresh lime juice, 1 tablespoon Trader Joe’s Hot & Sweet Jalapeños pickling liquid, 2 teaspoons Trader Joe’s Everything But the Elote Seasoning Blend, 1/3 cup olive oil, Kosher salt, to taste, Freshly ground black pepper, to taste, 1 (15-ounce) can black beans, drained and rinsed, 1 (15-ounce) can white or kidney beans, drained and rinsed, 1 medium red bell pepper, cored and diced, 1 medium yellow bell pepper, cored and diced, 5 scallions, trimmed and thinly sliced, 2 cups Trader Joe’s frozen roasted corn, thawed, 1 cup mini heirloom tomatoes, halved, 1/2 cup roughly chopped fresh cilantro, 1/4 cup Trader Joe’s Hot & Sweet Jalapeños, drained and chopped, 1 cup Trader Joe’s Giant Peruvian Inca Corn Salted Crunchy Snack, roughly chopped, Trader Joe’s Organic Elote Corn Chip Dippers, for serving","Calories: 238, Fat: 8g, Carbs: 35g, Protein: 10g","[{'name': 'Michelle Henry', 'review': 'You say kidney beans but i see a can of Northern white bean and in the salad. So I will have 3 different beans, red, white and black? Doesnt seem like enough wet dressing. No vinegar?'}]"
https://www.simplyrecipes.com/hot-smoked-salmon-dip-recipe-8757126,The 3-Ingredient Appetizer I Always Make for the Holidays,"For a quick, easy, and festive appetizer, make my 3-ingredient smoked salmon dip recipe. Warmed in the oven, it’s delicious served with bread, crackers, or veggies for dipping.",Simply Recipes,The 3-Ingredient Appetizer I Always Make for the Holidays,Maren Ellingboe King,"December 08, 2024","3-Ingredient Hot Smoked Salmon Dip Recipe
","8 ounces cream cheese,, room temperature, 4 to 6 ounces hot smoked salmon, flaked, 3 green onions, chopped, whites and dark greens divided, Kosher salt and ground pepper, to taste",,
https://www.simplyrecipes.com/spiced-cottage-cheese-dip-recipe-8762375,The 3-Ingredient Retro Appetizer I Make When I’m Feeling Nostalgic,"Spiced cottage cheese is served as a dip at Wisconsin supper clubs alongside crisp vegetable sticks and rye chips. This retro recipe is flavored with toasted caraway seeds and chopped green onions for a creamy, tangy dip that’s sure to be a crowd-pleaser.",Simply Recipes,The 3-Ingredient Retro Appetizer I Make When I’m Feeling Nostalgic,Ivy Manning,"January 23, 2025","Spiced Cottage Cheese Dip Recipe (3-Ingredient)
","1 teaspoon caraway seeds, 1 (16-ounce) tub full-fat, small curd cottage cheese, 2 green onions, trimmed and finely chopped, Salt and freshly ground black pepper, to taste",,
https://www.simplyrecipes.com/new-years-eve-hot-crab-dip-recipe-8759667,The Easy Appetizer I Make Every Single New Year's Eve,"My family makes this creamy, decadent hot crab dip every year for New Year’s Eve. It’s an elegant appetizer recipe for special occasions that’s secretly super easy to make—just stir it together and bake!",Simply Recipes,The Easy Appetizer I Make Every Single New Year's Eve,Nick Evans,"December 29, 2024","New Year’s Eve Hot Crab Dip Recipe
","Nonstick cooking spray or softened butter, 8 ounces cream cheese, softened, 1 (6-ounce) can lump crab meat, drained well, 1 tablespoon minced chives, plus more for garnish, 2 teaspoons, Old Bay seasoning, 1 teaspoon Worcestershire sauce, 1 teaspoon lemon juice, 1 clove garlic, grated or minced, Toasted baguette or crackers, for serving",,
https://www.simplyrecipes.com/smores-dip-recipe-7562499,This S’Mores Dip Is a Major Upgrade to the Classic Treat,And I plan to make it all year round because it only takes three ingredients and less than 15 minutes to make enough s'mores for a crowd.,Simply Recipes,S'Mores Dip,Abby Rose Notarnicola,"January 02, 2024","S'Mores Dip Recipe
Prep Time: 5 mins; Cook Time: 8 mins; Total Time: 13 mins; Servings: 8
to 10 Servings; Yield: 2 cups","1 1/2 cups semi-sweet chocolate chips, 2 cups mini marshmallows, Graham crackers, for dipping","Calories: 157, Fat: 8g, Carbs: 25g, Protein: 1g",
https://www.simplyrecipes.com/tomato-pie-dip-recipe-8637110,Tomato Pie Dip Packs All of the Flavors Without All the Work,"This tomato pie dip recipe takes the messy nature of tomato pie and turns it into an asset! Bake roasted cherry tomatoes with a cream cheese, mayo, cheddar, and herb base for an oozy, tangy dip everyone will love!",Simply Recipes,Tomato Pie Dip,Sara Bir,"August 09, 2024","Tomato Pie Dip Recipe
Prep Time: 15 mins; Cook Time: 60 mins; Rest Time: 15 mins; Total Time: 90 mins; Servings: 4 servings; Yield: 2 2/3 cups","1 1/2 pounds multi-colored cherry tomatoes (about 4 cups), halved, divided, 1/2 teaspoon kosher salt, 1 (8-ounce) package cream cheese, softened, 1/2 cup mayonnaise, 1/4 teaspoon onion powder, 1/4 teaspoon ground black pepper, plus more for garnish, 6 ounces sharp cheddar cheese, shredded, divided (about 1 1/2 cups), 1 tablespoon chopped Calabrian or pimento peppers, 1/2 teaspoon dried basil, 1 (10-ounce) baguette, 4 tablespoons salted butter, melted , Thinly sliced green onions, for garnish","Calories: 886, Fat: 68g, Carbs: 49g, Protein: 23g","[{'name': 'NK', 'review': 'Super delicious. Took it for a bridal shower pot luck in June. Was gone in 5 mins!!!! Now I am being asked to bring in larger quantity for Thanksgiving!!! I just made it a little more spicier for the Indian palate. Would give 10 stars if I could!!'}, {'name': 'Craig R', 'review': 'Lots of sweetness and tons of umami from the tomatoes. Love that this is made with cherry tomatoes - outside of summer it&#x27;s so difficult to find better tomatoes than cherries. Love the creaminess!'}]"
