page_url,og:title,og:description,og:site_name,Title,Author,Published Date,Description,Ingredients,Nutrition Facts,Reviews
https://www.simplyrecipes.com/recipes/deviled_eggs/,It's Not a Party Without Deviled Eggs ,"Deviled eggs are great for all kinds of gatherings, whether an Easter brunch, a summer picnic, or just because. Our recipe is classic, delicious and made in just 30 minutes.",Simply Recipes,Deviled Eggs,Elise Bauer,"April 25, 2025","Best Deviled Eggs Recipe
Cook Time: 30 mins; Total Time: 30 mins; Servings: 12 servings; Yield: 24 deviled eggs","12 large eggs, 2 teaspoons Dijon mustard, 1/3 cup mayonnaise, 1 tablespoon minced shallot or onion, 1/4 teaspoon Tabasco sauce, Kosher salt and freshly ground black pepper, to taste, Paprika, to taste","Calories: 114, Fat: 9g, Carbs: 1g, Protein: 6g","[{'name': 'Charlene Robbins', 'review': 'My mother&#x27;s recipe involved at least 12 or more eggs. After boiling and peeling them. We cut them in half and scoop out the yellow, add Miracle Whip, yellow mustard and Sweet dill pickle relish to taste. Everyone loves them and we seldom have many left over. Tried dill relish one time and it just wasn&#x27;t as good as sweet relish.'}, {'name': 'janmaus', 'review': 'What makes eggs ""deviled"" is not hot stuff, but MUSTARD!!! We\'re purists--just a bit of mayo and mustard in the yolks--no alliums (for some of us, onions are nasty), pickles of any sort, etc. We like olives of any variety or capers on top, and maybe a bit of brine in the yolk mix. For more heat, we like one of the chili crunch or chili crisp products currently in the midst of copyright issues sprinkled over the top. Off center yolks are always an issue, and the whites that look the least balanced get dumped. The extra filling just makes the rest look--and taste--great.'}, {'name': 'Lori McLean', 'review': 'Why are they called “devil eggs” when there is nothing deviled about them? My mother (and I) make deviled eggs using: egg yolks, mashed with a dab on mayo, a can of deviled ham (yes, there is the “devil”), some grated onion, mustard, salt, pepper. I think an aunt used a little pickle relish also but I don’t) . Much more delicious!!!!'}, {'name': 'Simone', 'review': 'Easy way to peel hard boiled eggs: add a little water in a glass jar. Drop egg in, put lid on and shake vigorously and the shell slips off easily'}, {'name': 'How to make hard boiled eggs', 'review': 'I start the eggs in a pot of cold water. Turn heat to high until the water comes to a rolling boil. Turn heat off and let pot sit for 12 to 15 minutes. Scoop eggs out and place in a bowl of ice water for a few minutes. Scoop them out and into tupperware. Let sit, pour off excess water, refrigerate.'}]"
https://www.simplyrecipes.com/recipes/bruschetta_with_tomato_and_basil/,This Timeless Bruschetta Recipe Wins Every Time,"A classic appetizer, our bruschetta is made with fresh chopped tomatoes, garlic, basil, olive oil and vinegar. Served piled atop toasted bread, it's a winner all the way around.",Simply Recipes,Bruschetta with Tomato and Basil,Elise Bauer,"November 26, 2024","Bruschetta with Tomato and Basil Recipe
Prep Time: 15 mins; Cook Time: 20 mins; Total Time: 35 mins; Servings: 6
to 10 servings","6 to 7 ripe tomatoes (about 1 1/2 pounds), 2 cloves garlic, minced (about 2 teaspoons), 1 tablespoon extra virgin olive oil, 1 teaspoon balsamic vinegar, 6 to 8 fresh basil leaves, thinly sliced or chopped, 3/4 teaspoon sea salt, more or less to taste, 1/2 teaspoon freshly ground black pepper, more or less to taste, 1 baguette, French bread, or similar Italian bread, 1/4 cup olive oil","Calories: 202, Fat: 8g, Carbs: 27g, Protein: 6g","[{'name': 'Meg', 'review': 'This was a big hit at our dinner party. Easy to make and super delicious! I used grape tomatoes and blended the mixture to be a coarse mix. We topped it with Parmesan sprinkles and optional pine nuts on the side as a nod to the flavors of pesto. Thanks so much!'}, {'name': 'Sharon W.', 'review': 'It’s our favorite ever! A little labor intensive, but always worth it!'}, {'name': 'Marie', 'review': 'Love this recipe! Excellent texture. Doubled the garlic...we love our garlic. Removing the seeds and liquid from the tomatoes is brilliant. 5 stars baby!'}, {'name': 'jeffersonallansmith', 'review': 'add some shredded mozzarella?'}, {'name': 'Jane McNiff', 'review': 'Simple, excellent directions, was a big hit!'}]"
https://www.simplyrecipes.com/easy-asparagus-tart-with-goat-cheese-5176556,Store-Bought Puff Pasty Is the Secret to This Easy Asparagus Tart ,This easy asparagus tart with goat cheese comes together quickly thank to store-bought puff pastry. It's perfect for weekend brunch or a light weeknight dinner.,Simply Recipes,Easy Asparagus Tart with Goat Cheese,Sarah Wharton,"November 05, 2024","Easy Asparagus Tart with Goat Cheese Recipe
Prep Time: 20 mins; Cook Time: 35 mins; Total Time: 55 mins; Servings: 6 servings","2 sheets frozen puff pastry, 2 eggs, at room temperature, 8 ounces herbed goat cheese, at room temperature, 1 ounce (about 3/4 cup grated) Pecorino Romano cheese, 1 pound asparagus, trimmed and peeled as needed, 1 teaspoon vegetable oil, 1/4 teaspoon kosher salt, Zest of 1 lemon","Calories: 218, Fat: 15g, Carbs: 8g, Protein: 13g","[{'name': 'Helen', 'review': 'I like to cut my asparagus into bite size pieces. It makes it easier to eat.'}, {'name': 'Saila Salo', 'review': 'Add some cured or smoked salmon or shrimps and you are ready for a party! Make experiments with other cheeses as well, this is an excellent basic recepy.'}, {'name': 'Yeddard', 'review': ""I make this with Brie and it's fantastic!""}]"
https://www.simplyrecipes.com/recipes/grilled_tomatillo_and_corn_salsa/,Grilled Tomatillo and Corn Salsa,"How to make a simple tomatillo salsa with grilled tomatillos, grilled corn, jalapeño, onions, and garlic.",Simply Recipes,Grilled Tomatillo and Corn Salsa,Elise Bauer,"May 21, 2025","Grilled Tomatillo and Corn Salsa Recipe
Prep Time: 15 mins; Cook Time: 25 mins; Total Time: 40 mins; Servings: 24 servings; Yield: 6 cups","3 pounds tomatillos, husks removed, rinsed clean, 2 corn cobs, husks still on, OR 2 cups cooked corn (Trader Joe's has frozen roasted corn which would work great), 1/4 cup chopped fresh cilantro, 2 cloves garlic, minced, 1 jalapeño pepper, minced (remove seeds for less heat), 3 to 4 tablespoons lime juice, 2 teaspoons salt, 1/4 teaspoon cayenne, 1/8 teaspoon cumin, 1/4 teaspoon dried oregano, 1/2 cup finely diced red onion","Calories: 37, Fat: 1g, Carbs: 7g, Protein: 1g","[{'name': 'Kelly K', 'review': ""Wow! This was some of the best salsa I've ever had. Sooooo flavorful!""}, {'name': 'Holly H', 'review': 'Made this for dinner tonight, OMG AMAZING. I did roast my jalapeno and , garlic, ued Red Pepper Flakes in place of cayenne.'}, {'name': 'Darlene Donaldson', 'review': 'Anyone know if this recipe can be safely canned?'}, {'name': 'Matt Smith', 'review': 'I loved this and can\'t wait to make it again. Took it to a church picnic yesterday and it was gobbled up.\n\nIn my case, it didn\'t taste ""grilled"" to me. It might be because my wife brought home corn cobs that were already shucked; they had to be grilled without the husks on. Next time I will try grilling the corn as specified. I think I will also try putting some soaked wood chips on my charcoal for some extra smoke.\n\nEven without the grill flavor, it was delicious. Thanks for the recipe!'}, {'name': 'Chris', 'review': 'Made this yesterday for the World Cup game. Followed to a T - this was delicious! I pulsed it too much, so next time I will be cognizant of that so it stays somewhat chunky.\n\nWe make your salsa verde at least twice a month, so this was a fun change. Thank you!'}]"
https://www.simplyrecipes.com/19-last-minute-party-snacks-and-appetizers-5205906,These 16 Last Minute Party Snacks and Appetizers Will Save the Day,"Keep last minute guests fed, entertained, and happy with these quick and easy party snack and appetizers.",Simply Recipes,16 Last Minute Party Snacks and Appetizers,"Sara Bir and Katie Morford, MS, RD","November 25, 2024","16 Last Minute Party Snacks and Appetizers
",,,
https://www.simplyrecipes.com/whipped-feta-with-figs-pistachio-and-honey-recipe-5207369,"Whipped Feta with Figs, Pistachio, and Honey","This creamy, salty feta dip with sweet figs, honey, and crunchy pistachios is as pretty as it is tasty. Bring it as a last-minute appetizer to a dinner party or serve it alongside a platter of dips.",Simply Recipes,"Whipped Feta with Figs, Pistachio, and Honey",Karishma Pradhan,"November 03, 2024","Whipped Feta with Figs, Pistachio, and Honey Recipe
Prep Time: 20 mins; Total Time: 20 mins; Servings: 4
to 6 servings","2 tablespoons honey, plus more for drizzling, 1/4 cup roasted and unsalted pistachios, finely chopped, 1/4 cup finely chopped dried figs, 2 tablespoons water, 8 ounces feta cheese in brine, drained and crumbled, 4 ounces cream cheese, at room temperature, 1/3 cup extra virgin olive oil, 1 tablespoon fresh mint leaves, minced, 1 small clove garlic, grated or finely minced, 1/8 teaspoon salt, 1/4 teaspoon black pepper, Warmed pita bread, naan, or crackers","Calories: 310, Fat: 27g, Carbs: 13g, Protein: 7g","[{'name': 'Destini R', 'review': ""Absolutely delicious! The feta I used was very salty, so I didn't add extra salt. It stayed very slightly lumpy from the feta as described in the recipe, but is very creamy and rich. The saltiness is toned down by the sweet pistachio topping and perfect when I ate it with plain pita bread.""}, {'name': 'Joanie Smith', 'review': 'Idea sounded good but the topping is way too sweet and the dip is way too salty! I added the extra cream cheese and some plain yogurt but couldn’t tame that salt.'}]"
https://www.simplyrecipes.com/smoked-salmon-crostini-recipe-5210368,Smoked Salmon Crostini Are Fast Yet Elegant and Totally Holiday-Ready,"Smoked salmon crostini are an easy, holiday-ready appetizer. Toasted baguette is smeared with a lemon, caper, chive, and dill cream cheese spread, then topped with pickled cucumbers and thin slices of cured salmon.",Simply Recipes,Smoked Salmon Crostini,Jessica Gavin,"September 09, 2024","Smoked Salmon Crostini Recipe
Prep Time: 30 mins; Cook Time: 10 mins; Total Time: 40 mins; Servings: 12 servings","1/4 cup red wine vinegar or apple cider vinegar, 2 tablespoons honey, 1 English cucumber, cut into about 36 1/8-inch rounds, 1 baguette, cut into 12 1/4-inch slices, Extra virgin olive oil, as needed for brushing, 4 ounces cream cheese, softened, 1 teaspoon lemon zest, 1 teaspoon lemon juice, 1 tablespoon capers, drained and roughly chopped, 1 1/2 teaspoons chives, finely chopped, 1 teaspoon dill, chopped, plus more for garnish, 6 ounces smoked salmon, thinly sliced, Freshly ground black pepper, for garnish","Calories: 215, Fat: 6g, Carbs: 31g, Protein: 9g","[{'name': 'Ann Vandielen', 'review': 'We just made this as a treat for this New Years Eve and wow - delicious! The fresh dill and chives put it over the top. Thanks for a great recipe.'}]"
https://www.simplyrecipes.com/mushroom-crostini-recipe-5210373,Mushroom Crostini Are the Ultimate Fast and Fancy Appetizer,Caramelized onion and mushroom crostini are a simple yet elegant hors d'oeuvres—perfect for when you want to impress your guests.,Simply Recipes,Mushroom Crostini,Jessica Gavin,"January 27, 2025","Mushroom Crostini Recipe
Prep Time: 25 mins; Cook Time: 45 mins; Total Time: 70 mins; Servings: 6 servings; Yield: 12 crostini","1 (8-inch) baguette, cut into 12 1/2-inch slices, 3 tablespoons extra virgin olive oil, plus more for brushing, 1 tablespoon unsalted butter, 1/2 teaspoon brown sugar, 1/2 teaspoon kosher salt, divided, 2 medium (3 cups) yellow onions, sliced 1/4-inch thick, 8 ounces cremini or baby bella mushrooms, sliced 1/4-inch thick, 2 teaspoons minced garlic, 1 teaspoon balsamic vinegar, 1 teaspoon soy sauce, 1/4 teaspoon black pepper, plus more for garnish, 4 ounces goat cheese, 1 tablespoon sliced chives, plus more for garnish, 1/2 teaspoon garlic powder, 1/2 teaspoon onion powder","Calories: 230, Fat: 14g, Carbs: 20g, Protein: 8g","[{'name': 'DR Feldman', 'review': 'I used Bourson (sp?) cheese. Yummy'}]"
https://www.simplyrecipes.com/guyanese-pholourie-recipe-5220589,Celebrate Holi With These Savory Split Pea Fritters (Bet You Can't Eat Just One!),"Guyanese pholourie are savory split pea fritters traditionally served alongside a bowl of tamarind chutney or mango sour. After one bite, you’ll keep going back for more.",Simply Recipes,Guyanese Pholourie ,Alica Ramkirpal-Senhouse,"August 14, 2024","Guyanese Pholourie Recipe
Prep Time: 10 mins; Cook Time: 25 mins; Misc Time: 60 mins; Total Time: 95 mins; Servings: 5 servings; Yield: 30 fritters","1/2 teaspoon (2g) granulated sugar, 1 teaspoon (4g) active dry yeast, 1/4 cup lukewarm water, 1 cup (160g) split pea flour (see Recipe Note), 1 1/4 cup (150g) all-purpose flour, 1/2 teaspoon (2g) baking powder, 1 1/2 teaspoon (6g) geera (roasted ground cumin, see Recipe Note), 1/2 teaspoon (2g) turmeric powder, 2 teaspoons (4g) salt, 1 1/2 cups warm water, 4 cloves garlic, grated, 1 small habanero or Scotch bonnet pepper, minced, 6 drops yellow food coloring, 2 cups neutral oil, for frying such as canola or vegetable oil","Calories: 340, Fat: 13g, Carbs: 41g, Protein: 10g","[{'name': 'Bikebird ', 'review': 'I like mine dipped in Matouk’s West Indian Hot sauce. Mmmm.'}, {'name': 'Austin Shelly', 'review': 'Delicious with mango chutney!'}]"
https://www.simplyrecipes.com/arepas-con-queso-recipe-5220266,Our Homemade Arepas con Queso Are Cheesy Bundles of Love,"Traditional Colombian arepas are savory corn cakes, and they're easier to make at home than you might think. This version is stuffed with cheese and can be served for breakfast, as an afternoon snack, or a light dinner.",Simply Recipes,Arepas con Queso,Maria J. Ritchie,"June 17, 2024","Arepas con Queso Recipe
Prep Time: 15 mins; Cook Time: 15 mins; Rest Time: 5 mins; Total Time: 35 mins; Servings: 6
to 8 servings; Yield: 10 (3-inch) arepas","2 cups (348g) masarepa, 2 teaspoons salt, 2 teaspoons sugar, plus more to taste, 2 tablespoons (28g) unsalted butter, at room temperature, 2 cups (200g) freshly shredded part-skim mozzarella cheese, divided, 1/4 cup (50g) whole milk, 2 1/2 cups (590g) lukewarm water, Nonstick cooking spray, for the skillet","Calories: 227, Fat: 5g, Carbs: 36g, Protein: 12g","[{'name': 'serena graziussi', 'review': 'I made this recipe today for my Colombian friend and the arepas where perfect! Thanks for the recipe!'}, {'name': 'Pasqualino Marcantonio', 'review': 'great recipe.\nI got hooked on arepas in Riohacha Colombia, last winter and finally decided to make some.\nI used the recipe on the flour bag but next time i will be brave and follow your more interesting recipe'}, {'name': 'Anne', 'review': 'Turned out like pancake batter'}, {'name': 'Olivia ', 'review': 'I must have not used the right kind of flour! I thought I could substitute masarepa with yellow corn flour because none of the groceries near me had the right kind, but I did end up with soup. I thought the water measurements must have been off, but I am guessing you cannot substitute. Noted for next time!'}, {'name': 'Anne Pinckard', 'review': 'Is the liquid amount correct? 2 1/2 cup water plus 1/4 cup milk? I ended up with a soup when I added it all in. The dough thickened a little, but is still quite soft and goopy. The arepas are not cooking up as crisp discrete things, but kind of like soft dumplings or something. I am not sure they will be edible. Very disappointed!'}]"
https://www.simplyrecipes.com/homemade-pizza-bagels-recipe-5222871,Cue the Nostalgia With These Homemade Pizza Bagels,You can assemble and bake these deeply nostalgic pizza bagels in almost the same time it takes to pull the frozen kind out of the freezer.,Simply Recipes,Homemade Pizza Bagels,Nick Evans,"May 16, 2025","Homemade Pizza Bagels Recipe
Prep Time: 5 mins; Cook Time: 15 mins; Total Time: 20 mins; Servings: 4 servings; Yield: 8 pizza bagels","4 full-sized plain bagels, halved, 1/2 cup pizza sauce (store-bought), 8 ounces shredded mozzarella cheese, 4 ounces mini pepperoni, Dried basil, for garnish","Calories: 678, Fat: 26g, Carbs: 77g, Protein: 33g","[{'name': 'Chase', 'review': 'I love using Dave&#x27;s Killer Bread, they are already perfectly seasoned for this!'}, {'name': 'Spike', 'review': ""I made an oops I cooked them for 18 minutes vs 8 - 10 minutes at 400F vs 350F, I guess I should read better and wear my glasses. But, hey they turned out great. I used a heavy cast iron griddle and probably added 20% more toppings - whatever I had as leftover in the refrigerator. I'll be making these more often and a good snack for football! It's a keeper.""}, {'name': 'Amy ', 'review': 'Love making bagel pizza never had frozen one when I was a child my favorite bagel is asiago cheese bagel thank you for the recipe'}, {'name': 'Kaden Greene', 'review': 'What can be a side dish for the Homemade Pizza Bagels?'}]"
https://www.simplyrecipes.com/tteokbokki-spicy-korean-rice-cakes-recipe-5224356,"How to Make Chewy, Sweet and Spicy Korean Tteokbokki at Home","Tteokbokki, spicy Korean rice cakes, are a popular Korean street food that comes together in 30 minutes. The rice cakes are soft and chewy, and coated with a sweet and spicy gochujang sauce.",Simply Recipes,Tteokbokki (Spicy Korean Rice Cakes),Myo Quinn,"February 26, 2025","Tteokbokki (Spicy Korean Rice Cakes) Recipe
Prep Time: 5 mins; Cook Time: 25 mins; Total Time: 30 mins; Servings: 2
to 4 servings","2 large eggs, 1 tablespoon vegetable oil, 1 small yellow onion, cut into 1/2-inch halfmoons, 3 green cabbage leaves, cut into 2-inch squares, 2 cloves garlic, minced, 1 1/2 cups water, 1 pound (about 3 cups) garaetteok (cylindrical Korean rice cakes), 2 scallions, ends trimmed and cut into 2-inch pieces, 3 tablespoons gochujang, 1 tablespoon soy sauce, plus more to taste, 2 teaspoons sugar, plus more to taste, 1 teaspoon toasted sesame oil, 1 teaspoon toasted sesame seeds","Calories: 440, Fat: 10g, Carbs: 79g, Protein: 10g","[{'name': 'Lynn', 'review': 'Thank you for sharing your story and your recipe Myo. I really enjoyed reading about your recipe. I love Korean food, but do not make it much myself. This recipe intrigues me enough to try making it.. I appreciate all the details of the process of making this dish, and the ""Why\'s"" of how you do each step. Now off to find these ingredients :)'}]"
https://www.simplyrecipes.com/kuku-sabzi-persian-herb-frittata-recipe-5224380,Bite-Sized Baked Weeknight Kuku Sabzi (Persian Herb Frittata),These kuku sabzi are festive and vibrant baked eggs filled to the brim with fresh herbs. Barberries add a pop of brightness. It’ll delight your tastebuds!,Simply Recipes,Kuku Sabzi (Persian Herb Frittata),Mersedeh Prewer,"December 31, 2024","Kuku Sabzi (Persian Herb Frittata) Recipe
Prep Time: 20 mins; Cook Time: 20 mins; Total Time: 40 mins; Servings: 4
to 6 servings; Yield: 12 kuku","3 tablespoons olive oill, divided, 3 1/2 ounces fresh flat leaf parsley (about 1 bunch), 3 1/2 ounces fresh cilantro (about 1 bunch), 3 1/2 ounces fresh dill (about 1 bunch), 5 scallions, dark green part only, 1 1/2 ounces baby spinach (a generous handful), 2 cloves garlic, 6 large eggs, 1/2 teaspoon ground turmeric, Zest of 1 lime (about 1/2 packed teaspoon), 1 tablespoon all-purpose flour, 1/2 teaspoon kosher salt, 1/4 teaspoon freshily ground black pepper, 2 tablespoons dried barberries, 1 tablespoon chopped raw walnuts, plus more for garnish","Calories: 176, Fat: 13g, Carbs: 8g, Protein: 9g","[{'name': 'Jelena', 'review': 'Thanks for an interesting recipe. Are there any alternatives to barberrries? Thanks in advance!'}]"
https://www.simplyrecipes.com/grilled-bacon-wrapped-salmon-bites-with-lemon-garlic-mayo-5225090,This Bacon-Wrapped Salmon Is a Grill Time Game Changer,"Grilling fish doesn’t have to be scary, just wrap it in bacon for extra flavor, crispiness, and the confidence that it won’t stick to the grill.",Simply Recipes,Grilled Bacon-Wrapped Salmon Bites with Lemon Garlic Mayo,Genevieve Taylor,"May 27, 2025","Grilled Bacon-Wrapped Salmon Bites Recipe
Prep Time: 30 mins; Cook Time: 11 mins; Total Time: 41 mins; Servings: 4
to 6 servings; Yield: 12 salmon bites","1 lemon, 1 1/2 cups (150g) mayonnaise, 1 to 2 cloves garlic, finely minced, 1/2 teaspoon sea salt, 1/4 teaspoon freshly ground black pepper, 1 1/3 pounds (600g) skinless salmon filet, at least 1 inch thick, 2 tablespoons finely chopped chives, 1/2 teaspoon sea salt, 1/2 teaspoon freshly ground black pepper, 12 slices very thin bacon, 2 teaspoons smoked paprika (optional), 24 small metal skewers or wooden toothpicks","Calories: 492, Fat: 40g, Carbs: 3g, Protein: 29g","[{'name': 'Tonya ', 'review': 'Can I bake these? No barbecue to use. If yes then what temperature and how long to cook them? Thank you.'}, {'name': 'Annie H', 'review': 'This was tasty — bacon got nice and crispy on the outside, but stayed softer on the inner layer that kept the salmon soft and juicy. It did take slightly longer than 3 min per side to crisp the bacon — closer to ~5 minutes per side.'}]"
https://www.simplyrecipes.com/recipes/turkey_tacos_with_cranberry_salsa/,These Easy Turkey Tacos with Cranberry Salsa Will Delight Anyone Sick of Turkey Sandwiches,Make this turkey taco recipe with cranberry salsa to use up Thanksgiving turkey leftovers.,Simply Recipes,Leftover Turkey Tacos with Cranberry Salsa,Elise Bauer,"November 13, 2023","Leftover Turkey Tacos with Cranberry Salsa Recipe
Prep Time: 15 mins; Cook Time: 10 mins; Total Time: 25 mins; Servings: 4 servings","8 to 12 corn or flour tortillas, Extra virgin olive oil, 2 cups Monterey Jack cheese, or mild cheddar, grated, Cooked turkey meat, cut into bite-sized pieces, Lettuce, thinly sliced, Fresh cilantro, for garnish, 1 1/2 cups fresh or frozen cranberries, 1/2 apple, peeled and cored, Chopped serrano or jalapeno chili, to taste (about a half a chili but taste for desired heat), 4 tablespoons sugar, 2 tablespoons ginger, peeled and chopped, 2 tablespoons fresh cilantro, chopped, 1 tablespoon lime or lemon juice, Dash salt","Calories: 491, Fat: 26g, Carbs: 50g, Protein: 19g","[{'name': 'Dan', 'review': 'Corn tortilla? Picture is using flour.'}, {'name': 'Lisa', 'review': '<p>I lay in wait for cranberries to be in season and in the stores and buy extra bags just to be able to freeze some so that I can have this recipe any time of the year I want to! It is (in my humble opinion), the best way to use up the rest of your white meat from your Thanksgiving turkey. The cranberry salsa has so many complex flavors, with sweet, sour and hot notes. It pairs really well with the crunchy, salty shells, creamy cheese and turkey in the taco! All I have to say is YUM!...Oh and MAKE THIS!</p>'}, {'name': 'Lisa', 'review': ""<p>Yummmmm! I made this recipe with some of my leftover turkey and it did not disappoint! It makes my mouth water just thinking about it! I loved the cranberry salsa; it had such a great combination of flavors that really complimented the turkey. My husband wants me to make another turkey just so he can have these again. Elise - I was wondering...are there other recipes (that doesn't involve roasting another turkey) that you use the cranberry salsa with? </p>\n\n<p><em>Hi Lisa, you can also serve the cranberry salsa with steak. All kinds of salsa taste great with steak. I would try it with roast chicken too for that matter. ~Elise</em></p>""}, {'name': 'Kara Lewis', 'review': ""<p>I've just recently discovered your blog and am hooked! I'm looking forward to reading all the archives. I have mucho cranberries in my freezer, so this salsa sounds perfect -- do you think it could be canned, and therefore giftable?</p>\n\n<p><em>Note from Elise: Since it is raw, not cooked, you can't can it as is. You would have to cook it to can it, which you might want to try anyway, just to see how it tastes.</em></p>""}, {'name': 'Becki', 'review': ""<p>This looks great. I can't wait to try that cranberry salsa.</p>\n\n<p>I use your recipes constantly and rarely comment, but wanted to share with you my favorite recipe I've made from leftover turkey this year. There are no real measurements:</p>\n\n<p>Turkey Curry Salad<br />\nCombine about 1 cup plain yogurt, a couple of tablespoons of curry powder (to taste), chopped chives, chopped parsley, salt, and pepper. To this mixture, add chopped turkey, golden raisins, chopped pecans, chopped celery, and chopped granny smith apple. This is better if you leave it in the fridge overnight before eating.</p>\n\n<p>Thanks for all your great recipes, Elise!</p>""}]"
