page_url,og:title,og:description,og:site_name,Title,Author,Published Date,Description,Ingredients,Nutrition Facts,Reviews
https://www.simplyrecipes.com/recipes/basil_hummus/,"Basil Hummus Is a Vibrant, Herbaceous Take on the Classic Dip","This bright green, herby take on the classic dip is hard to resist.",Simply Recipes,Basil Hummus,Elise Bauer,"November 09, 2024","Basil Hummus Recipe
Prep Time: 15 mins; Cook Time: 5 mins; Total Time: 20 mins; Servings: 12 servings; Yield: 3 cups","1/4 cup pine nuts, 2 cups basil leaves, packed, 3 cloves garlic, smashed then minced, 2 (15-ounce) cans garbanzo beans (chickpeas), rinsed and drained (see Recipe Note), 1/3 cup fresh lemon juice, 1/4 cup extra virgin olive oil, 1 to 1 1/2 teaspoons salt, 1 teaspoon tomato paste, Several dashes Tabasco, Up to 1/4 cup water","Calories: 121, Fat: 8g, Carbs: 11g, Protein: 4g","[{'name': 'VLHassi', 'review': 'Can this be frozen?'}, {'name': 'Chris', 'review': ""This is amazing. Thanks. I had basil and garbanzos in the fridge that I needed to use up and thought it might work so I googled it and found this amazing recipe. Had to sub cashews for pine nuts &#38; had only half the basil. I tasted it before adding tobasco and tomato and it was so freaking amazing that I bailed on those last two ingredients. I didn't want to change the amazing concoction. One day I will try it with the tobasco, and maybe even the tomato eventually. Great recipe.""}, {'name': 'Kate in Sacramento', 'review': ""We are fans of this in my family. I made it because my basil is going crazy and I already have pesto in the freezer. As other reviews mentioned it wasn't as green as the picture, but that doesn't concern me. It has a robust flavor and we like that! I didn't have pine nuts so I subbed walnuts and will continue to use them when I make more.""}, {'name': 'lola', 'review': ""Mine didn't turn out the same green color as your hummus. Also I felt like there was a little too much basil for my liking, but it was still very good and I'll probably make it again.""}, {'name': 'Jeff', 'review': ""My daughter said it was too salty. I didn't see anyone else mentioning that? I might try doubling it tomorrow and not add any more salt.""}]"
https://www.simplyrecipes.com/recipes/mediterranean_mezze_platter/,Shake It Up and Make an Easy Mezze Platter for Dinner ,"Use the ingredients listed as a starting point, with room to swap in other dips, vegetables, or fruits depending on what’s in season and what you have on hand.",Simply Recipes,Mediterranean Mezze Platter,"Katie Morford, MS, RD","November 03, 2024","How to Make the Best Mezze Platter
Prep Time: 20 mins; Total Time: 20 mins; Servings: 4 servings","1/2 cup Kalamata or other flavorful olives, 1/2 cup plain Greek yogurt, stirred with a pinch of salt and drizzle of olive oil, 1 cup hummus (homemade or store-bought), 1 cup Easy Muhammara, 2/3 English cucumber, sliced, 1 cup cherry tomatoes, 1 large carrot, cut on the diagonal into slices, Small bunch grapes, 4 ounces feta cheese, broken into pieces, lightly drizzled with olive oil and a pinch of herbs, 3 pita breads, quartered, brushed lightly with olive oil, and warmed in the oven","Calories: 611, Fat: 35g, Carbs: 58g, Protein: 23g","[{'name': 'Mezze lover', 'review': 'A big hit at my party! Thank you.'}]"
https://www.simplyrecipes.com/recipes/how_to_make_candied_bacon/,2-Ingredient Candied Bacon Is Brunch Magic,"Make candied bacon in the oven in just half an hour. Eat it as is, crumble it over salad, or use it to garnish a Bloody Mary—the choice is yours!",Simply Recipes,How to Make Candied Bacon,Nick Evans,"November 26, 2024","Candied Bacon Recipe
Prep Time: 5 mins; Cook Time: 25 mins; Total Time: 30 mins; Servings: 4
to 6 servings","12 strips bacon (not thick-cut, about one pound), 1/4 cup light brown sugar, 1/2 teaspoon freshly ground black pepper (optional)","Calories: 137, Fat: 8g, Carbs: 8g, Protein: 8g","[{'name': 'Diane', 'review': 'Pieces on top of deviled eggs for Easter Brunch'}, {'name': 'Faceplant ', 'review': 'I make this but put a light sprinkle of bbq seasoning, make my own, has brown and turbinano sugar in it, ads a great depth of flavor, also use peppered bacon, makes a great garnish for bloody Mary&#x27;s'}, {'name': 'JJ', 'review': 'Great Recipe... I did not think of freezing it... Where have I been??'}, {'name': 'Barb', 'review': ""Sprinkle a bit of cayenne over the brown sugared bacon (instead of black pepper) for that 'oh so delightful' mouth-watering hot and spicy addition.""}, {'name': 'Danielle ', 'review': 'How to I stop from getting the grease left on the bacon like the white greasy stuff'}]"
https://www.simplyrecipes.com/recipes/cheddar_cheese_puffs/,Cheddar Cheese Puffs Are the Fast and Fancy Appetizer You're Looking For,"5-ingredient cheddar cheese puffs, also called gourgères, are a light and airy appetizer for any occasion.",Simply Recipes,Cheddar Cheese Puffs,Elise Bauer,"November 20, 2024","Cheddar Cheese Puffs (Gourgères) Recipe
Prep Time: 5 mins; Cook Time: 45 mins; Total Time: 50 mins; Servings: 24 servings","1 stick butter (8 tablespoons or 4 ounces), 1 cup water, 1/2 teaspoon salt, 1 cup all-purpose flour, 4 large eggs, 1 cup (4 ounces) grated sharp cheddar cheese, 2 teaspoons chopped fresh thyme or rosemary, Freshly ground pepper","Calories: 84, Fat: 6g, Carbs: 4g, Protein: 3g","[{'name': 'JustinaB', 'review': 'How far ahead of a party should I make these. Is night before okay?'}, {'name': 'Mary Ann Severyn', 'review': 'What would be a good filling for these?'}, {'name': 'Me', 'review': 'Since I didn’t have parchment paper so I used aluminum. I made sure they weren’t burning at the bottom so I took one off. I dropped it and it landed on its bottom. Well the top of it was good but not all the way cook so definitely do the times. Trust the process. \nNot at all salty and I can’t wait for my little one to try. They did in fact puff up.'}, {'name': 'Rosa Von', 'review': 'My son and I love them. I used to make similar puffs, but with ordinary grated cheese and parmesan, but these are so much better! I have to use gluten-free flour and I believe that is why they don&#x27;t &#x27;puff&#x27; as much as they ought to, so next time around I might try adding some baking powder - there is definitely going to be a next time! All in all, a simple and delicious recipe. I have made a pâte a choux dough before, so no challenge here. Highly recommended if you like cheesy things. ;-)'}, {'name': 'dawn', 'review': 'what temperature &amp; how long do you bake them from frozen'}]"
https://www.simplyrecipes.com/recipes/salmon_mousse/,Be Hit of the Party With This Retro Salmon Mousse,This easy salmon mousse is a retro classic! Try it spread on crackers or as a vegetable dip.,Simply Recipes,Salmon Mousse,Elise Bauer,"November 07, 2024","Salmon Mousse Recipe
Prep Time: 10 mins; Cook Time: 15 mins; Chilling: 6 hrs; Total Time: 6 hrs 25 mins; Servings: 12 servings","1 pound freshly cooked or canned boneless salmon, 1/2 cup diced celery, 1/2 cup diced green bell pepper, 1/4 cup finely chopped onion, 3 tablespoons chopped fresh dill, 1/2 cup mayonnaise, 1/2 cup plain yogurt, 3 tablespoons lemon juice, 8 ounces block cream cheese, 1 (10.75-ounce) can condensed tomato soup, or 8 ounces pureed tomato sauce, 3 to 4 dashes Tabasco sauce, 3/4 cup cold water, 4 teaspoons or 2 envelopes unflavored, unsweetened gelatin, Sliced avocados, celery sticks, lettuce leaves, tomatoes, olives, slices of baguette, and/or crackers, for serving, optional","Calories: 237, Fat: 18g, Carbs: 6g, Protein: 12g","[{'name': 'AILEEN FITZPATRICK', 'review': 'This quantity is much more than my mold. Can I freeze half?'}, {'name': 'Pat Massey', 'review': 'Can this mousse be frozen I want to make it and take it to a friend 8 hours way'}, {'name': 'Joan DeTrou', 'review': ""Ok Elise. I've been following your recipes for a while. All pretty good. But as long as you have the guts to throw are recipe out there using canned tomato soup, I have a question for you. Years ago, when I lived in Sacramento (grew up Carmichael) my friend and I hosted a bridal shower. She said we would make lobster bisque. I said we couldn't afford that. Well, she threw together canned lobster and tomato soup and vermouth and I don't know what else. It was outstanding!! She's is gone now, unfortunately passed away. Would you have this recipe? Thanks, and enjoy Sacramento. Lots of great people there!""}, {'name': 'Kelly', 'review': 'This was really good. In fact, I was tempted to just offer it up as dip before the gelatin stage.\n\nDue to corona virus limitations and personal preferences, I made some substitutions.\n\nSaut&#233;ed the vegetables\nSubstituted a little thyme, basil and lemongrass as I did not have any dill\n\nNext time I might either add a little cayenne or a jalape&#241;o to spice it up.'}, {'name': 'Mark Hinchman', 'review': ""I've made it 3 times, twice as written. I served it once for lunch, and once as an appetizer to a heartier meal that followed. As an appetizer, I made melba toast using Pepperidge Farm thin white bread on which to spread the mousse. This last time, I decided to up the vegetable content, and added 1/2 cup of diced zucchini and fresh parsley. And my experience is, use any type of pepper you wish. I think a combo of yellow, orange and green peppers would look lovely.""}]"
https://www.simplyrecipes.com/recipes/caponata_eggplant_relish/,Caponata—The Perfect Spread for Bread or Dip for Breadsticks,"Made with eggplant, onions, garlic, tomatoes, pine nuts, olives, raisins, capers, and parsley, caponata is a perfect spread for bread or a dip for breadsticks!",Simply Recipes,Caponata,Elise Bauer,"October 06, 2024","Caponata (Eggplant Relish)
Prep Time: 90 mins; Cook Time: 15 mins; Total Time: 105 mins; Servings: 8
to 10 servings","1 globe eggplant, about 1 pound, diced, Kosher salt, 4 tablespoons extra virgin olive oil, divided, 1 small onion, minced, 1 stalk celery, minced, 1 garlic clove, minced, 4 to 6 plum tomatoes, finely chopped, 1/2 cup pitted green olives, finely chopped, 1/4 cup pine nuts, toasted, 2 to 3 tablespoons small capers, drained, 1 teaspoon red pepper flakes, 1/4 cup red wine vinegar, 2 to 3 tablespoons sugar, 1 tablespoon tomato paste, 1/4 cup chopped basil, Freshly ground black pepper","Calories: 157, Fat: 10g, Carbs: 18g, Protein: 2g","[{'name': 'H.P. Loathecraft', 'review': 'Joey’s restaurant in Vancouver used to offer tandoori pizza as a menu item which I indulged every single time I visited. They used a semi-pureed eggplant relish as a sauce. Pure magic.'}, {'name': 'Nancy Torrisi', 'review': 'I took a cooking class in Sicily this summer and this was one of the recipes that we made. It is my all time favorite dish using eggplant! Tomatoes were not used in our recipe, but red peppers, zucchini and squash were used in addition to golden raisins, olives, and toasted pine nuts. Massimo also recommended that it be served at room temperature, almost like a salad or relish to accompany the main dish. Either way its a favorite in our home and made at least once a week! Buon appetit!'}, {'name': 'Liz', 'review': ""I made a very similar recipe, 2 weeks ago with my 2 small CSA eggplant and good golly, it is great! Best thing I've done with eggplant ever!""}, {'name': 'Rosanna', 'review': ""I suggest cook celery first, simply boiling it in salted water and set apart. Then fry the eggplant, diced bigger than in the pictures. Put the fried eggplant on paper and set apart. In a skillet with not much oil, fry the onion. When the onion is tender, add eggplant, celery, olives, capers, tomato. Stir well and adjust salt. At the end, add one big spoon of sugar and add vinegar, according to your taste. Cook one minute, stirring. This is my mother's caponata, directly from Sicily.""}, {'name': 'Marian Hodges', 'review': 'I am thinking of leaving the olives uncooked so they will retain their texture. I also may leave 1/2 of the diced tomatoes uncooked to retain a crisper taste and flavor. Have you tried to incorporate any uncooked ingredients?'}]"
https://www.simplyrecipes.com/recipes/shrimp_dip/,Throw This Retro Shrimp Dip Together in 10 Minutes ,A classic cold shrimp dip recipe for parties made with small pink shrimp that comes together in 10 minutes.,Simply Recipes,Easy Shrimp Dip,Elise Bauer,"October 14, 2024","Easy Shrimp Dip Recipe
Prep Time: 10 mins; Total Time: 10 mins; Servings: 8 servings; Yield: 2 cups","8 ounces cream cheese, room temp, 1/4 cup mayonnaise, 2 to 4 tablespoons lemon juice (2 if regular lemon, 4 if Meyer lemon), more to taste, 1 teaspoon finely grated lemon zest, 3/4 pound cooked, shelled, small pink shrimp (salad shrimp), 1/4 cup sliced scallions, including the greens, 2 tablespoons finely chopped fresh parsley, 1/4 teaspoon Tabasco or Crystal hot sauce, Freshly ground black pepper to taste","Calories: 232, Fat: 21g, Carbs: 4g, Protein: 7g","[{'name': 'David F.', 'review': 'Many Buffalo chicken or shrimp dips are baked, which I’m not a fan of.\nSolution? This recipe with extra hot sauce. Cold Buffalo shrimp dip!'}, {'name': 'Melissa', 'review': 'Just a note, scallions are not the same as green onions. This recipe should say green onions. \nAlso add splash of liquid crab boil for depth of flavor.'}, {'name': 'Citizen Arcane', 'review': 'Simple, yet elegant. I substituted available frozen precooked (thawed before use) crawfish tails and added a healthy splash of medium heat picante for flavor and color - excellent!'}, {'name': 'Dottie Paradis', 'review': 'Super delicious!!!! I used 1 tbsp fresh squeezed lemon juice and healthy amount of zest. The family loved it.'}, {'name': 'francine corry', 'review': 'See a lot of folks commenting on too much lemon.Season to taste as you proceed when cooking,salt,pepper etc.'}]"
https://www.simplyrecipes.com/recipes/blue_cheese_sauce/,Making Blue Cheese Sauce at Home is Easy and Worth It,"This homemade blue cheese sauce is begging to go with burgers, steak, and wings and is so much better than the store-bough stuff. Make a double batch for your next cookout!",Simply Recipes,Blue Cheese Sauce,Summer Miller,"December 20, 2024","Blue Cheese Sauce Recipe
Prep Time: 6 mins; Chill: 30 mins; Total Time: 36 mins; Servings: 8 servings; Yield: 1/2 cup","3 ounces blue cheese, crumbled, plus more for garnish, 3 tablespoons buttermilk, 2 tablespoons sour cream, 1 clove garlic, minced, 1 teaspoon lemon juice, 1/2 teaspoon Worcestershire sauce, 1/4 teaspoon freshly ground black pepper, 1/4 teaspoon ground mustard powder, 1/4 teaspoon kosher salt","Calories: 48, Fat: 4g, Carbs: 1g, Protein: 3g","[{'name': 'Alex', 'review': 'Excellent! Only thing I would change is putting the blue cheese in after everything is mixed together. My sauce turned out a bit gray, but still delicious.'}, {'name': 'Jason', 'review': 'Made this for an impromptu steak night and it was delicious. Will definitely be a new staple in my dipping sauce repertoire'}, {'name': 'LARRY', 'review': 'Easy and delicious. I recommend the funkier the better for the cheese. I added chopped chives for color, but this one is a keeper.'}, {'name': 'Bryan', 'review': 'The best! Great on anything, but excellent dressing as well -- thanks!'}, {'name': 'Lori Williams', 'review': 'Can you serve blue cheese sauce warm?'}]"
https://www.simplyrecipes.com/recipes/eggplant_dip_baba_ganoush/,How to Make The Very Best Baba Ganoush,"Classic Baba Ganoush is made by roasting eggplants until soft, scooping out the insides, and mashing with tahini, garlic, and spices. Served with pita or cracker, this eggplant dip is a great snack or party appetizer.",Simply Recipes,Baba Ganoush (Eggplant Dip),Elise Bauer,"December 12, 2024","Baba Ganoush (Eggplant Dip) Recipe
Prep Time: 10 mins; Cook Time: 40 mins; Total Time: 50 mins; Servings: 4
to 8 servings","1 to 2 globe eggplants (totaling 2 pounds or 900g), 3 tablespoons extra virgin olive oil, 2 to 3 tablespoons roasted tahini (sesame paste), 1 to 2 garlic cloves (more or less depending on how garlicky you want your baba ghanoush to be), finely chopped, 1/2 teaspoon ground cumin, Juice of 1 lemon (about 2 1/2 tablespoons), Salt and cayenne pepper to taste, 1 tablespoon chopped parsley","Calories: 124, Fat: 8g, Carbs: 13g, Protein: 2g","[{'name': 'Angel', 'review': 'Delicious and Easy eggplant recipe! Substituted lime for the lemon and &#x27;Moroccan seasoning&#x27; for the spices. Also used a blendtec blender to mix super light fluffy and creamy! Awesome appetizer! Well paired with pita chips...will make again'}, {'name': 'Carolyn', 'review': 'What a great recipe which was loved by the family. Perfect balance and so easy to make. I noted another comment about not using metal - I did use a wooden spoon and it did keep it&#x27;s light colour. Will definitely be remaking this'}, {'name': 'Judy Lichtenstein', 'review': 'Don&#x27;t use metal fork or spoon to mash eggplant. If you use wood, plastic or rubber spatula, the eggplant will keep it&#x27;s nice light color.'}, {'name': 'Elizabeth Reece', 'review': 'Wow! So easy and delish!'}, {'name': 'Anne', 'review': 'Tried this, very good!'}]"
https://www.simplyrecipes.com/recipes/copy_cat_chipotle_guacamole/,You'll Think This Copycat Chipotle Guacamole Came Right from the Restaurant,"If you love the lime- and cilantro-spiked guacamole from Chipotle Mexican Grill, then this recipe is for you. It will make all of your tortilla chip dipping dreams come true.",Simply Recipes,Copycat Chipotle Guacamole,Marta Rivera,"November 20, 2024","Copycat Chipotle Guacamole Recipe
Prep Time: 15 mins; Total Time: 15 mins; Servings: 8 servings; Yield: 2 cups","4 ripe Hass avocados, 3 cloves garlic, 1/2 teaspoon kosher salt, plus more to taste, 1/2 medium red onion, 1/2 large jalapeño, optional, 1/4 cup chopped cilantro, 2 tablespoons fresh lime juice (squeezed from 1 large lime), Tortilla chips, store-bought or homemade","Calories: 82, Fat: 3g, Carbs: 15g, Protein: 1g","[{'name': 'Allison', 'review': 'This is delicious and definitely tastes like Chipotle&#x27;s guacamole!'}, {'name': 'LiZa Sims', 'review': ""Thank you for NOT adding tomatoes! I hate tomatoes in Guac. They make it watery and dilute the nutty buttery avo, and yet so many restaurants and recipes do include them. Now, THIS is Guac! I've never been to Chipotle's so cannot speak to that. Thank you for your purist, no nonsense approach to my favorite dip in the world.""}, {'name': 'northstar', 'review': ""I recall reading that if u store your guacamole in a small container, pressing the guacamole down & then poring a small amount on water over it before refrigerating. When u want to use it simple carefully pour off the water..it will not get brown & doesn't affect the taste of it. I've never tried this but it makes sense.""}, {'name': 'Anna', 'review': 'I cannot STAND cilantro but this is delicious, going to be making another batch soon!!'}, {'name': 'Karen N.', 'review': 'Fantastic! And yes! It needs the garlic it adds sooo much! To keep it from browning, look up ""guac lock"" container. You\'re welcome'}]"
https://www.simplyrecipes.com/recipes/quick_and_easy_artichoke_dip/,You Only Need 3 Ingredients to Make the Best Artichoke Dip,Make quick and easy artichoke dip at home in the oven or microwave with just 3 ingredients.,Simply Recipes,Easy Artichoke Dip,Elise Bauer,"November 19, 2024","Easy Artichoke Dip Recipe
Prep Time: 10 mins; Cook Time: 20 mins; Total Time: 30 mins; Servings: 6
to 8; Yield: 3
to 4 cups","2 (14-ounce) cans water-packed artichokes, drained, 8 ounces Parmesan cheese, freshly grated (about 2 cups), 1 cup mayonnaise, Kosher salt and freshly ground black pepper, to taste, if needed","Calories: 359, Fat: 29g, Carbs: 16g, Protein: 11g","[{'name': 'Rosemary Wagner', 'review': 'Girl! So good. But I added onion powder and sour cream and let me tell you SO GOOD. Sour cream, warm or not, makes everything better. Try it ;)'}, {'name': 'Barbara', 'review': 'Very good. will certainly make it again. I added some personal touch, chives and hot pepper.'}, {'name': 'Hillary', 'review': 'WOW! This was quick and easy, but the best part DELICIOUS! Sure wished I took a picture of it, but by the time I thought about it....I was too late we all ate it all'}, {'name': 'Charlie', 'review': 'Thought I would give this a go when I was doomed to an evening by myself, with just the TV for company. Only now I have found my best friend to keep me company! I only had a jar of artichokes in oil, so I used those. The dip was wonderful with herby crackers and a glass of (or2) of white wine. I made a smaller batch than the recipe and there was none left over. Serves them right for leaving me alone.'}, {'name': 'Marlene', 'review': 'The best recipe for this!!'}]"
https://www.simplyrecipes.com/recipes/tomatillo_salsa_verde/,Got Tomatillos? Make Salsa Verde!,"An easy, fresh recipe that comes together quickly in a blender.",Simply Recipes,Tomatillo Salsa Verde,Elise Bauer,"April 21, 2025","Tomatillo Salsa Verde Recipe
Prep Time: 20 mins; Cook Time: 15 mins; Total Time: 35 mins; Servings: 12 servings; Yield: 3 cups","1 1/2 pounds tomatillos (about 12 medium), 1/2 cup chopped white onion, 2 cloves (or more) garlic, optional, 1/2 cup chopped cilantro leaves and stems, 1 tablespoon fresh lime juice, 2 jalapeño or serrano peppers, stemmed, seeded and chopped (you can use whole for more heat if you want), Salt to taste","Calories: 24, Fat: 1g, Carbs: 5g, Protein: 1g","[{'name': 'Marshall Jones', 'review': 'Tomatillos are not available where I live, so I used green tomatoes and small Thai eggplants at about a 3:1 ratio. I used two Serrano chilies and one Thai Birdseye chili. I roasted everything except the lime and cilantro. Turned out very nice as a tortilla chip dip, or for Chicken Verde enchiladas. Thanks.'}, {'name': 'Todd Hills', 'review': 'I halved the jalapeño and blistered those with the tomatillo. This is a go to about every month or so.'}, {'name': 'TahoeGal', 'review': 'this is a great recipe although adding a bit of chicken broth makes a world of difference in the most delicious way'}, {'name': 'Kristin Sloan', 'review': 'First time I’ve ever grown, harvested, and even MADE tomatillo anything let alone this salsa verde! So easy to make this let alone prepare the tomatillos by broil method! Thank you for such a delicious recipe!! This is definitely keeper!!'}, {'name': 'MJ', 'review': 'We make this every year with home grown tomatillos, garlic &amp; jalapeños. I haven’t quite figured out how to grow the onions and cilantro successfully to time with my other crops. Dang it is so good! I make about 20 x the recipe, share and freeze the rest. It is amazing. Thanks for this!'}]"
https://www.simplyrecipes.com/recipes/slow_cooker_spinach_feta_dip/,This Slow Cooker Spinach Feta Dip Is Sure to Go Fast,"This creamy, cheesy warm dip is packed with spinach. Serve it with veggies or pita chips for game day or any party.",Simply Recipes,Slow Cooker Spinach Feta Dip,Nick Evans,"December 20, 2024","Slow Cooker Spinach Feta Dip Recipe
Prep Time: 10 mins; Cook Time: 90 mins; Total Time: 100 mins; Servings: 4
to 6 servings","2 bunches fresh spinach or 10 ounces frozen spinach, 1 tablespoon olive oil, 1/8 teaspoon kosher salt, 8 ounces cream cheese, 1/2 cup sour cream, 6 ounces feta cheese, crumbled, 1/4 teaspoon garlic powder, Pita chips or sliced veggies, for serving","Calories: 281, Fat: 25g, Carbs: 6g, Protein: 9g","[{'name': 'CookbookCollector', 'review': ""This recipe delivered on being easy to prep, low maintenance and delicious. It would be such a no - brainer to do this when you're cooking for a big party and have 50 things working and no room in the oven. I brought it to my book club meeting and everyone loved it. It's rich and yummy, everything you'd want in a dip and a reason to feel good about gorging on Stacy's pita chips (OMG I can't stop myself with those things!!). For the heat output of my slow cooker on high, I wish I'd turned it to low at 60 minutes instead of 90. I felt like the spinach went from still brightish green to camo green in that final 30 minutes on high (and may turn out differently had I used fresh spinach instead, for sure). There's not much left, but I'm looking forward to putting it on bread and throwing it under the broiler.""}, {'name': 'Molly', 'review': ""In the first picture under step 2, there's something red in the pot with the cheeses. Is there salsa added?""}, {'name': 'Paige', 'review': 'Look delicious. I usually buy big tubs of Spinach from Costco. How many ounces of fresh spinach would be equal to two bunches?'}]"
