page_url,og:title,og:description,og:site_name,Title,Author,Published Date,Description,Ingredients,Nutrition Facts,Reviews
https://www.simplyrecipes.com/easy-grilled-peppers-recipe-5323334,These Grilled Peppers Make a Delicious Lazy Summer Side Dish!,"Jazz up your al fresco menu with these grilled peppers—they are a quick and easy summer side dish for burgers, grilled meat, or grilled seafood.",Simply Recipes,Easy Grilled Peppers,Sally Vargas,"May 25, 2025","Easy Grilled Peppers Recipe
Prep Time: 20 mins; Cook Time: 10 mins; Total Time: 30 mins; Servings: 4 servings; Yield: 4 grilled peppers","Vegetable oil, for the grill, 4 large sweet bell peppers (any color), 1/4 cup olive oil, 1 teaspoon kosher salt, Olive oil, Red wine or balsamic vinegar , Kosher salt, to taste","Calories: 194, Fat: 20g, Carbs: 3g, Protein: 1g","[{'name': 'navisos', 'review': 'The huge black burns are carcinogenic. Beware!'}, {'name': 'Maria', 'review': 'I came from an Italian home where my Mom or Nonna would roast red peppers. After they were peeled they were sliced into thinner pieces placed in a bowl dish with raw garlic pieces and olive oil to just to go over everything. Salt and pepper if you so wished and then let it set for a while to absorb the flavors. I always made a sandwich of Italian bread that was nice and fresh and to me it was the best tasting sandwich, even if I had just finished eating my meal. There was something about freshly roasted red peppers, irresistible!'}]"
https://www.simplyrecipes.com/corn-and-ricotta-bruschetta-recipe-5324635,Give Tomato Bruschetta a Break and Make This One With Fresh Corn and Ricotta,"This thick toast piled high with fluffy ricotta and sweet corn is the perfect low-effort, high-reward summer meal or appetizer.",Simply Recipes,Corn and Ricotta Bruschetta ,Georgia Freedman,"May 27, 2025","Corn and Ricotta Bruschetta Recipe
Prep Time: 5 mins; Cook Time: 15 mins; Misc: 5 mins; Total Time: 25 mins; Servings: 4 servings; Yield: 8 pieces of bruschetta","2 ears fresh sweet corn, shucked, 2 tablespoons unsalted butter, divided, 1/2 red onion, small dice, 1/2 teaspoon kosher salt, 1/4 teaspoon freshly ground black pepper, 8 mint leaves, very thinly sliced, 8 thick slices whole-grain batard or boule bread (cut about 4 inches wide, 5 inches long, and 1 inch thick), 16 ounces ricotta cheese, 4 mint leaves, very thinly sliced","Calories: 261, Fat: 16g, Carbs: 18g, Protein: 15g",
https://www.simplyrecipes.com/grilled-okra-recipe-5509262,Hate Slimy Okra? Just Grill It!,"Okra is an easy vegetable to grill, and the high heat brings out its best qualities for a smoky, delicious, and tender but not slimy side dish. Serve as is or with a simple dipping sauce.",Simply Recipes,Grilled Okra,Laurel Randolph,"May 23, 2025","Grilled Okra Recipe (Not Slimy!)
Prep Time: 10 mins; Cook Time: 8 mins; Soak Time: 30 mins; Total Time: 48 mins; Servings: 4 servings","1/4 cup tahini, stirred, 1 clove garlic, finely grated, 2 tablespoons fresh lemon juice, 1 to 3 tablespoons warm water, as needed, 1/2 teaspoon kosher salt, 1/4 teaspoon cayenne pepper, or to taste, 1 pound okra, 1 tablespoon canola or vegetable oil, plus more for oiling the grates, 1/4 teaspoon kosher salt, or to taste","Calories: 55, Fat: 4g, Carbs: 5g, Protein: 2g",
https://www.simplyrecipes.com/esquites-recipe-5649771,Use Fresh or Frozen Corn for the Best Mexican Esquites,"Esquites, a warm Mexican corn salad, is a sweet and savory explosion of flavors. We recommend peak season fresh corn, but frozen works too!",Simply Recipes,Esquites (Warm Mexican Corn Salad),Susy Villasuso,"March 12, 2025","Esquites (Warm Mexican Corn Salad) Recipe
Prep Time: 10 mins; Cook Time: 30 mins; Total Time: 40 mins; Servings: 4
to 6 servings; Yield: 7 cups","6 ears fresh sweet corn, shucked, 4 tablespoons (56g) salted butter, 2 cloves garlic, 1 dry bay leaf, 1 tablespoon kosher salt, plus more to taste, 2 cups water, 1/2 cup mayonnaise, 1/4 cup ground ancho chiles or Tajín, divided, 4 limes, divided , 7 ounces (about 200g) grated queso fresco or cotija cheese, 1 cup chopped cilantro leaves and tender stems , 3/4 cup (about 200g) Mexican crema, Cholula hot sauce, to taste","Calories: 436, Fat: 34g, Carbs: 28g, Protein: 11g","[{'name': 'Pamela Anderson', 'review': 'If you can use frozen corn.. how many cups equal the 6 ears of corn?'}, {'name': 'Katherine Lopez ', 'review': 'Delicious 😋 yummy thank you 😊'}]"
https://www.simplyrecipes.com/pimento-cheese-recipe-6361320,Pimento Cheese Is the Spread That Doubles as a Dip,"Pimento cheese is a versatile, creamy dip that’s popular in the South, and this classic version is easy and full of flavor. Serve with vegetables and crackers, or as a sandwich spread.",Simply Recipes,Pimento Cheese,Stephanie Burt,"January 23, 2024","Pimento Cheese Recipe
Prep Time: 10 mins; Chill Time: 60 mins; Total Time: 70 mins; Servings: 8 servings; Yield: 2 cups","2 (8-ounce) blocks extra sharp cheddar cheese, freshly grated, 2/3 cup Duke's mayonnaise, 2 (4-ounce) jars chopped pimentos, drained, 2 teaspoons Worcestershire sauce, 1 teaspoon hot sauce (your favorite brand), Salt and pepper, to taste","Calories: 366, Fat: 33g, Carbs: 3g, Protein: 14g","[{'name': 'janmaus', 'review': 'Excellent basic recipe with about the perfect amount of mayo. I often add finely diced green chilies or jalapenos and skip the hot sauce. While many recipes add cream cheese, this is the classic style my family prefers.'}, {'name': 'Betty', 'review': 'Just like grandmas! So happy.'}]"
https://www.simplyrecipes.com/pajeon-korean-scallion-pancakes-recipe-5509292,These Is the Easiest Pajeon Recipe Ever,"This basic pajeon recipe comes together so quickly, you’ll be making them again and again. It’s just sliced scallions and an easy batter using pantry staples.",Simply Recipes,Pajeon (Korean Scallion Pancakes),Cynthia Christensen,"November 04, 2024","Pajeon (Korean Scallion Pancakes) Recipe
Prep Time: 15 mins; Cook Time: 25 mins; Total Time: 40 mins; Servings: 4
to 6 servings; Yield: 4 pajeon","1/4 cup soy sauce, 2 teaspoons rice vinegar, 1 scallion, white part only, finely chopped, 1 teaspoon sesame oil, 1 teaspoon sugar, 1/2 teaspoon toasted sesame seeds, 1/2 teaspoon gochugaru, optional, 1 1/2 cups (180g) all-purpose flour, 1/2 cup (75g) rice flour, 1 teaspoon kosher salt, 1/4 teaspoon garlic powder, 1/4 teaspoon onion powder, 1/4 teaspoon baking powder, 1 1/2 cups water, plus more as needed, 1 large egg, 1 teaspoon sesame oil, 6 scallions, 3 tablespoons vegetable oil","Calories: 248, Fat: 9g, Carbs: 35g, Protein: 6g","[{'name': 'Kyle', 'review': 'These were delish. I’m going to try them with ramps next spring. Can’t wait!'}, {'name': ':D', 'review': 'Do you use regular rice flour and not glutinous rice flour? Can you use brown rice flour?'}]"
https://www.simplyrecipes.com/marinated-mushrooms-recipe-6363025,These Marinate Mushrooms Belong on Your Next Antipasto Platter,"When you’re having friends over, serve these easy marinated mushrooms. It's a quick recipe to make ahead and pull out of the fridge like magic.",Simply Recipes,Marinated Mushrooms,Sally Vargas,"March 27, 2025","Marinated Mushrooms Recipe
Prep Time: 10 mins; Cook Time: 5 mins; Misc. Time: 20 mins; Total Time: 35 mins; Servings: 8; Yield: 2 cups","1 pound small cremini or white button mushrooms, 3 tablespoons olive oil, 2 whole cloves garlic, peeled, 3 tablespoons white wine vinegar, 1 teaspoon kosher salt, 1 tablespoon chopped rosemary leaves, 1 tablespoon chopped parsley, 1 tablespoon thyme leaves, 2 wide strips lemon zest (made using a vegetable peeler), 1/8 teaspoon red pepper flakes, Extra olive oil, for drizzling, Extra chopped herbs","Calories: 81, Fat: 7g, Carbs: 4g, Protein: 1g","[{'name': 'Diane', 'review': 'Perfect recipe, I love it. Why are there no comments before mine? Well done!'}]"
https://www.simplyrecipes.com/easy-pickle-dip-recipe-11756071,The Easy Pickle Dip I’m Making All Summer Long,"This easy pickle dip recipe combines chopped dill pickles and pickled banana peppers in a creamy dip that’s spiked with ranch seasoning. It’s tangy, briny, and easy to make ahead for entertaining.",Simply Recipes,The Easy Pickle Dip I’m Making All Summer Long,Stephanie A Ganz,"June 20, 2025","Easy Pickle Dip Recipe (Make-Ahead)
","1 (8-ounce) block cream cheese,, softened to room temperature, 1/2 cup mayonnaise (preferably, Duke’s, ), 1/2 cup sour cream, 2 tablespoons ranch seasoning, 1 cup chopped dill pickles, plus pickle brine as needed, 1/4 cup chopped mild banana peppers, optional, Salt and freshly ground pepper, to taste, A few sprigs fresh dill, optional",,
https://www.simplyrecipes.com/frozen-chocolate-covered-bananas-recipe-6455362,You Just Need 3 Ingredients to Make Frozen Chocolate-Covered Bananas,"For an easy frozen treat, coat slices of ripe bananas with dark chocolate and stick them in the freezer.",Simply Recipes,Frozen Chocolate-Covered Bananas,Rachel Knecht,"November 03, 2024","Frozen Chocolate-Covered Bananas Recipe
Prep Time: 20 mins; Cook Time: 2 mins; Chill Time: 2 hrs; Total Time: 2 hrs 22 mins; Servings: 6
to 8 servings; Yield: 18
to 20 banana slices","2 medium ripe bananas, 6 ounces dark chocolate, 1 1/2 teaspoons canola oil, Flaky salt, sprinkles, nuts, or shredded coconut for topping, optional","Calories: 150, Fat: 8g, Carbs: 20g, Protein: 1g","[{'name': 'Patricia Shelton', 'review': 'I found if you freeze fresh sliced banana and use a toothpicks to dip, you can dip, swirl to shake off excess chocolate then it solidifies quickly so it does not drip so much.'}]"
https://www.simplyrecipes.com/frito-pie-dip-recipe-8423912,My Highly Shareable Frito Pie Dip Makes Dinnertime a Party,"Forget messing around with the flimsy little bags and transform your Frito pie into a communal dinner over a hot skillet of cheesy, beany dip. This Frito pie dip recipe is ready for parties or cozy nights at home.",Simply Recipes,Frito Pie Dip,Sara Bir,"March 08, 2024","Frito Pie Dip Recipe
Prep Time: 10 mins; Cook Time: 30 mins; Total Time: 40 mins; Servings: 4
to 8 servings; Yield: 4 cups","4 ounces cream cheese, softened , 1/4 cup sour cream, divided, 1 teaspoon onion powder, 2 (15-ounce) cans chili (such as Amy’s Kitchen), about 3 cups , 4 ounces shredded Monterey Jack cheese (about 1 cup), 2 cups (4 ounces) lightly crushed corn chip scoops (such as Fritos Scoops), plus more for serving , 1 small plum tomato, chopped , 1/4 cup chopped fresh cilantro, 1 green onion, sliced, 1 teaspoon finely grated lime zest (from 1 lime), plus wedges for serving","Calories: 282, Fat: 20g, Carbs: 17g, Protein: 11g","[{'name': 'Douglas kenny', 'review': 'Being a Te-xan, I grew up eating Frito chili pie. Eighty years later, it&#x27;s still a favorite! We didn&#x27;t use cream cheese and we certainly added jalapeños, but I&#x27;ll give this recipe a try (with added heat).'}, {'name': 'Craig R', 'review': 'Super simple! Loved all the fresh topping, and the texture from the fritos.'}]"
https://www.simplyrecipes.com/chutney-cheese-appetizer-recipe-7969652,My Mom’s Retro Dip Might Be the Best Thing I’ve Ever Made,"My family has long made this easy dip recipe, passed down by culinary superstars of the Bay Area. It takes just 4 ingredients and 5 minutes to whip up, perfect for last-minute gatherings.",Simply Recipes,My Mom’s Retro Dip Might Be the Best Thing I’ve Ever Made,Coco Morante,"November 02, 2024","Chutney Cream Cheese Appetizer Recipe
","Crash Hot Potatoes with Smoked Salmon, Potato Skins, Mushroom Crostini",,
https://www.simplyrecipes.com/microwave-caramel-corn-recipe-7105327,Easy Microwave Caramel Corn From Scratch: It’s All in the Bag ,"Fast, easy to clean up after, and utterly snackable. The secret is a big brown paper bag.",Simply Recipes,Microwave Caramel Corn ,Sara Bir,"April 15, 2025","Microwave Caramel Corn Recipe
Cook Time: 4 mins; Cooling Time: 20 mins; Total Time: 24 mins; Servings: 8 servings; Yield: 8 cups","8 to 9 cups plain popped popcorn (from 1/4 cup kernels), 1 cup brown sugar (light or dark), 1/4 cup corn syrup (light or dark), 3 tablespoons unsalted butter, 1/2 teaspoon salt, 1 teaspoon vanilla extract, 1/4 teaspoon baking soda","Calories: 158, Fat: 4g, Carbs: 31g, Protein: 0g","[{'name': ""M'lud"", 'review': 'You forgot to add the peanuts and a prize! :-) CrackerJack®'}, {'name': 'Jackie', 'review': 'reminds me of how my mom used to make popcorn balls'}, {'name': 'Annie R.', 'review': 'Wow just like what mom used to make. Lots of memories here. The hardest part was finding a paper bag.'}]"
https://www.simplyrecipes.com/three-ingredient-sausage-ball-recipe-8739057,My Grandmother's Retro 3-Ingredient Appetizer Is a Family Favorite,"My family has plenty of holiday food traditions, and this 3-ingredient hot appetizer is a must. We serve it with brunch, as a snack, and as part of a spread.",Simply Recipes,My Grandmother's Retro 3-Ingredient Appetizer Is a Family Favorite,Laurel Randolph,"November 04, 2024","3-Ingredient Sausage Ball Recipe
","1 pound bulk pork sausage, room temperature, 2 cups Bisquick baking mix, 1 pound shredded cheddar cheese, cold",,
https://www.simplyrecipes.com/walking-tacos-recipe-7964497,Walking Tacos Are the Nostalgic Snack You Need Right Now,"The tastiest, most fun snack I've ever tasted.",Simply Recipes,Walking Tacos,Myo Quinn,"July 13, 2025","Walking Tacos Recipe
Prep Time: 10 mins; Cook Time: 10 mins; Total Time: 20 mins; Servings: 8 servings","1 pound ground beef (80/20), 1 large white onion, finely chopped (about 2 cups), divided, 1 teaspoon kosher salt, 1 (15-ounce) can pinto beans, rinsed and drained, 1 (1-ounce) package taco seasoning or 2 tablespoons Homemade Taco Seasoning, 1/2 cup salsa (any kind), 8 (3.5-ounce) bags corn chips, such as Fritos, 2 cups finely shredded romaine lettuce, 8 ounces shredded Monterey Jack cheese, 1 large tomato, chopped, 1/2 cup tender cilantro stems and leaves, 1/2 cup sour cream, Pickled jalapeños and hot sauce, for garnish","Calories: 247, Fat: 14g, Carbs: 16g, Protein: 14g","[{'name': 'Vasu', 'review': 'Love this recipe! Prepped all the toppings and had a few differnt bags of chips for the guests, based on comments below. Easy for individual guests to assemble. Kept the cheese in a fondue pot for single serving nachos!.Everyone loved this idea! So easy and such a hit! Only 1 change id make next time- to cut the bag at the side, so the opening is wider and it&#x27;s easier to grab the chips, but all in all- a super hit! Thank you for this!.'}, {'name': 'Jackie', 'review': 'Good, but next time I’ll use flavored Doritos. This is similar to the Frito chili pies we buy at rodeos.'}, {'name': 'Lindsay D', 'review': 'I really liked this dish and appreciated how easy it was to heat up on a busy night. I followed the make ahead instructions and topped with cheese and Fritos before baking in the evening, allowing me to get dinner on the table in 15 minutes. I really like the creaminess the sour cream and cheese added and thought it balanced nicely with the spice and acid from the tomato and salsa, I also really liked the crunch from the Fritos. We used all the suggested toppings and I think they added a lot, and especially liked the pickled jalapenos.'}]"
https://www.simplyrecipes.com/alabama-fire-crackers-recipe-7967390,I Can't Stop Eating This No-Cook Southern Snack,"You're bound to see a bowl of these seasoned crackers in certain areas of the South. They're salty, buttery, crunchy, and a little spicy—the ideal snack!",Simply Recipes,Alabama Fire Crackers,Myo Quinn,"February 20, 2025","Alabama Fire Crackers Recipe
Prep Time: 5 mins; Marinating Time: 12 hrs; Total Time: 12 hrs 5 mins; Servings: 25 servings","1 1/2 cups neutral oil (such as grapeseed or canola), 2 (1-ounce) packages ranch seasoning, 1 1/2 tablespoons seasoning salt (such as Lawry’s), 1 tablespoon dried parsley, 2 teaspoons crushed red pepper flakes, 1 teaspoon ground black pepper, 1 (16-ounce) box saltine crackers","Calories: 202, Fat: 15g, Carbs: 15g, Protein: 2g","[{'name': 'ROCKJUSTICE', 'review': ""I used to make a similar, healthier version in bulk. I used melted butter and hot sauce, put crackers a bowl, use a branded product some of the store brands don't work, drizzle with the market butter and hot sauce, toss and bake till crisp,""}, {'name': 'Wannabuyavowel', 'review': ""Saltines just didn't make sense to me as I wanted something to put in a snack bowl. I bought a 12 oz. box and a 9 oz. pkg.of Oyster Crackers--21 ounces total. Threw them all in the bag with the first 6 ingredients and rotated away. Perfection and a nifty little snack! CAVEAT: All Seasoned Salt is not created equal. I first made this with a store brand seasoned salt. The sodium content was about 60 grams per serving greater than the Lawry's and my first batch was waaaaay to salty.""}, {'name': 'SMS', 'review': ""A huge thank you for this timely recipe! We made this with oyster crackers in the 70's and that was a big hit. Now, that receipe forgotten and with so many gluten free, I have a plethera of pricey, tasteless crackers left from the holidays ready to toss. \nYour recipe is an delicious remendy for tasty gluten free faves ,YAY!!! Caveate,,,Make sure all ingredients used are gluten free if that's your need! Dry Italian dressing works well too. I also agree with the added salt, so much flavor it's not need.""}, {'name': 'Mama Lo', 'review': 'This is a great recipe! I’ve made several versions of these and they are so adaptable. No problem with leaving out the red pepper or using a different kind of seasoning. I also like to make it with oyster crackers.'}, {'name': 'Joe', 'review': ""This, or a close variation (Tony Chachere's Creole Seasoning) of this, has been popular in and around New Orleans for decades. Regardless of what you name them, they are simply addictive, no matter what version of seasoning you use.""}]"
https://www.simplyrecipes.com/chile-con-queso-recipe-8424993,"For the Absolute Best Queso, Skip the Velveeta","Chile con queso is a gooey, melted cheese dip featuring diced tomatoes, chiles, and seasonings. It’s easy to make at home and fun to eat with crispy tortilla chips.",Simply Recipes,Chile Con Queso,Laurel Randolph,"January 29, 2025","Chile Con Queso Recipe (3 Steps, 20 Minutes)
Prep Time: 10 mins; Cook Time: 10 mins; Total Time: 20 mins; Servings: 8 servings","8 ounces Monterey Jack cheese, shredded (about 2 cups), 1 tablespoon cornstarch, 1/2 teaspoon kosher salt, 1/2 teaspoon garlic powder, 1/2 teaspoon onion powder, 1/4 teaspoon chili powder, 1 (12-ounce) can evaporated milk, shaken well, 4 ounces (6 slices) sliced white American cheese, cut into 1-inch pieces, 1 (14.5-ounce) can fire-roasted diced tomatoes, drained, 1 (4.5-ounce) can chopped mild green chiles, drained, Fresh cilantro, for garnish (optional), Tortilla chips, for serving","Calories: 233, Fat: 16g, Carbs: 11g, Protein: 13g","[{'name': 'Wendy ', 'review': 'Advice On how to cook in the crockpot?'}, {'name': 'Ciara K', 'review': ""So creamy and flavorful! The fire-roasted tomatoes add the perfect depth of flavor. I can't wait to use this in so many things, including nachos!""}, {'name': 'flyingcars', 'review': ""Yum! Great recipe!! So easy & versatile!!\n\nI just made the Velveeta & Rotel one yesterday, at my husband's request, and it was heavy and just so Velvetta-y!! I added more tomatoes & green chili's to thin it, but the cheese still felt too rich, thick, & overwhelming. I was worried about using unprocessed cheese in queso (I've had a few bad experiences!) and so I'm very pleased to have found your recipe!!""}, {'name': 'CK', 'review': ""So creamy and flavorful! The fire-roasted tomatoes add the perfect depth of flavor. I can't wait to use this in so many things, including nachos!""}, {'name': 'Julia L', 'review': 'This was the easiest (best??) queso I’ve ever made! It melted effortlessly and without risk of breaking. The method was easy, seamless, and the end result was delicious. I’d make this again and again.'}]"
https://www.simplyrecipes.com/triscuit-thingies-recipe-8730469,My Grandma’s Triscuit Thingies Make the Holidays Special,"My grandma always made Triscuit” thingies” for every holiday gathering, and they disappeared lightning fast. The crunchy, creamy, savory appetizer is ideal for parties since it is so easy to make.",Simply Recipes,My Grandma’s Triscuit Thingies Make the Holidays Special,"Sara Haas, RDN, LDN","November 19, 2024","Triscuit Thingies Recipe (Easy Appetizer)
","1 cup mayonnaise, 1 cup grated Parmesan cheese, 1/2 cup sour cream, 1 tablespoon minced, dried onion, 1 teaspoon Tabasco sauce, 1/2 teaspoon, Worcestershire sauce, 32 Triscuit crackers",,
https://www.simplyrecipes.com/grilled-cedar-plank-brie-recipe-7481592,"You’ll Love This Easy, Oozy Cedar Plank Grilled Brie","Fire up the grill with a creamy brie, lightly smoked on cedar wood planks, and topped with a juicy blackberry & thyme relish. It’s the ultimate appetizer to serve this grilling season!",Simply Recipes,Grilled Cedar Plank Brie,"Micah Siva, RD","May 19, 2025","Grilled Cedar Plank Brie Recipe
Prep Time: 20 mins; Cook Time: 20 mins; Soak Time: 30 mins; Total Time: 70 mins; Servings: 6 servings","1 (8-ounce) wheel brie cheese, 1/2 cup fresh blackberries, halved, 1 tablespoon honey, 2 teaspoons balsamic vinegar, 1/2 tablespoon chopped fresh thyme, 1/2 teaspoon kosher salt, 1/2 teaspoon black pepper, 1 loaf baguette, 3 tablespoons extra-virgin olive oil, 1 teaspoon kosher salt","Calories: 332, Fat: 18g, Carbs: 29g, Protein: 13g","[{'name': 'Cjhdly', 'review': 'Can’t wait to try this! Blackberries are a favorite of mine-why hadn’t I thought to use on Brie?? Great idea. My mouth waters at the thought, and the pictures! Will comment after using recipe soon.'}]"
https://www.simplyrecipes.com/corn-dog-muffins-recipe-7550182,These Easy Corn Dog Muffins Are Adorable 4th of July Fun,"Golden, fluffy cornbread is studded with sliced hot dogs in this super-cute riff on corn dogs. Have ketchup or mustard at the ready—this no-fuss corn dog muffin recipe comes together in 20 minutes!",Simply Recipes,Corn Dog Muffins,Annika Panikker,"May 23, 2025","Corn Dog Muffins Recipe
Prep Time: 10 mins; Cook Time: 10 mins; Total Time: 20 mins; Servings: 10 servings; Yield: 20 muffins","1/2 cup (207g) finely ground yellow cornmeal, 1/2 cup (168g) all-purpose flour, 1 teaspoon baking powder, 1/4 teaspoon baking soda, 1/8 teaspoon salt, 2 tablespoons (78g) granulated sugar, 1/4 cup (130g) butter, melted (for more flavor, brown the butter) , 1 egg, 1/2 cup buttermilk, 5 to 6 hot dogs, Mustard, Ketchup, Relish","Calories: 380, Fat: 22g, Carbs: 38g, Protein: 8g","[{'name': 'RB', 'review': 'Wondering what you think about cooking the hot dogs a little bit first (Air fryer ) so they get nice and brown/grilled.'}, {'name': 'Bernard ', 'review': 'CAn you use jiffy cornbread mix?'}, {'name': 'Alissa', 'review': 'I made these in a normal muffin tin (not mini) and cut the hot dogs the same size (1 inch). The only change I had to make was increasing bake time to 15 minutes (instead of 10). It made 12 muffins. They&#x27;re tasty with hot honey! They&#x27;re also good with ketchup.'}, {'name': 'Rikki', 'review': 'The gram to cup measurements are wrong. I should&#x27;ve noticed before preparing as I bake enough to know better... but mom life is hectic so I didn&#x27;t realize until the finished product. I weigh my ingredients for precision. Big mistake.'}, {'name': 'Munni P', 'review': ""Very simple, very easy corn dog muffin recipe! These muffins tasted as you'd expect - a sweet corn muffin paired with a salty hot dog. It was delicious. Highly recommend!""}]"
https://www.simplyrecipes.com/pepperoni-calzones-5104686,How to Make Homemade Pepperoni Calzones,Pepperoni and ricotta calzones are jam-packed with filling. For this recipe I use our easy No Knead pizza dough! It bakes up golden brown and delicious. Don’t forget extra sauce for dipping!,Simply Recipes,Pepperoni Calzones,Nick Evans,"February 21, 2025","Pepperoni Calzone Recipe
Prep Time: 20 mins; Cook Time: 35 mins; Inactive Time: 3 hrs; Total Time: 3 hrs 55 mins; Servings: 4
to 6 servings; Yield: 4
to 6 calzones","2 pounds (32 ounces) prepared pizza dough, 4-6 tablespoons marinara sauce, plus more for dipping, 8 ounces ricotta cheese, 4 ounces pepperoni, sliced, 8 ounces mozzarella cheese, grated, 2 tablespoons fresh oregano, chopped, 1 large egg, 1 tablespoon water","Calories: 663, Fat: 28g, Carbs: 73g, Protein: 27g","[{'name': 'Julie Stroeve', 'review': 'add all the things you love on pizza to your calzone...you&#x27;re gonna love it!'}]"
https://www.simplyrecipes.com/zucchini-butter-recipe-7567749,Transform Excess Zucchini Into Succulent Zucchini Butter,"Do you have more zucchini than you know what to do with? Make zucchini butter! The 5-ingredient spread is easy, delicious, and versatile.",Simply Recipes,Easy Zucchini Butter,Sara Bir,"November 04, 2024","Easy Zucchini Butter Recipe
Prep Time: 10 mins; Cook Time: 45 mins; Total Time: 55 mins; Servings: 8
to 12 servings; Yield: 2
to 3 cups","2 to 4 tablespoons extra-virgin olive oil, divided, 2 1/2 pounds (3 medium-large) zucchini, 3 cloves garlic, smashed and peeled, 3 to 6 sprigs fresh thyme, Salt, to taste, Freshly ground black pepper, About 1 teaspoon fresh lemon juice","Calories: 36, Fat: 3g, Carbs: 3g, Protein: 1g","[{'name': 'Karishma P', 'review': ""This recipe was super simple -- and a great way to use up *tons* of zucchini in the summer. I loved the soft, jammy, buttery texture of the squash!\n\nAs recommended, I served it with pasta, and stirred in some parmesan cheese for a bit of saltiness. I added a dollop of whipped ricotta on top for creaminess, and it was so good! Highly recommend. \n\nI have a good amount leftover to use throughout the rest of this week, and I'm really excited to continue experimenting.""}]"
